id,name,slug,type,active,danger,description,url_path,biomes,created_at,region_ids,tier,parent_id,probability_by_region
07336b31-a038-47a0-a10f-52a9aff46865,Stoors (River Hobbits),stoors,hobbits,all-day,0,"The Stoors are the stockiest Hobbit folk and often appear shorter than some of the Harfoots because of their wide profile. Generally, however, they are taller than Harfoots and shorter than Fallohides. Their coloration is also somewhat of a compromise, although they have curly brown hair which resembles that of their shorter cousins. Nonetheless, the most distinguishing features of Stoors are their huge hands and feet (large even by Hobbit standards) and frequent beard growth. Stoors prefer riversides and flatlands. Some have begun relying on surface dwellings of wood, brick, or stone. Stoors trace their lines through the female. River- and marsh-loving folk, they are met poling boats and tending weirs in Dunland, the wetlands of Eriador and the Gladden country, and are warier of strangers than other Hobbits.",,,2026-06-15 20:28:26.533974,"{17,21,41,42,43,59,60,72,85}",group,,"[{""region"": ""Dunland"", ""probability"": ""Medium""}, {""region"": ""The Shire"", ""probability"": ""Medium""}, {""region"": ""En Egladil"", ""probability"": ""Hard""}, {""region"": ""Trollshaws"", ""probability"": ""Absurd""}, {""region"": ""West Rhudaur"", ""probability"": ""Extremely Hard""}, {""region"": ""Enedhwaith"", ""probability"": ""Sheer Folly""}, {""region"": ""Mintyrnath"", ""probability"": ""Absurd""}, {""region"": ""Rast Vorn"", ""probability"": ""Absurd""}, {""region"": ""South Downs"", ""probability"": ""Absurd""}]"
21c55236-fcec-4c44-9150-2fbb6052d0fa,Fallohides (Forest Hobbits),fallohides,hobbits,all-day,0,"The Fallohides are the tallest and average between 3 and 4 feet in height. They have fair skin and, of all the groups, resemble Men the most. Their numbers are small, however, and some observers have confused them with nearby mannish groups. Fallohides enjoy the woodlands found in cool northern climes. Some have begun relying on surface dwellings of wood, brick, or stone. Fallohides are the most prone to mingle with Big People. Harfoots and Fallohides trace their lines through either the male or female. Those Hobbits who dare venture away from home are assumed to be extraordinary, and therefore get five background points.",,{forest},2026-06-15 20:28:26.534911,"{85,86}",group,,"[{""region"": ""The Shire"", ""probability"": ""Medium""}, {""region"": ""Bree"", ""probability"": ""Medium""}]"
370b7ab2-1439-402f-9d23-7d0a0b90ea6f,Black Númenoreans,black_nmenoreans,humans,all-day,3,"The term ""Black Númenorean"" (S. ""Mornúmenedain"") is used to describe Men of Dúnedain stock who are descended from the ""Unfaithful"" Númenorean colonists and conquerers who came to Middle-earth during the middle and late Second Age. These Unfaithful had broken with the Valar and Elves who had bequeathed them the island kingdom of Númenor at the beginning of the Second Age, and many worshipped their own idols or paid homage to the Dark Lord Sauron. Physical Character: Strong and imposing, with angular features. Men average 225 pounds, women 150 pounds. After long years in the hot South, the Black Númenoreans have tanned, grey-brown skin, and black hair. Their piercing eyes are various shades of grey. Considerable endurance. Men average 6'4"", women 5'10"". Lifespan: 90-175 years. +25 to Sailing maneuvers. +10 to melee Offensive Bonuses, -10 to Defensive Bonus. Black and gold are their favored colors. They wear rich clothing made of dyed silk and cotton. Their societies are well-ordered and ruled by force of personality, backed by harsh law. Dictators and oligarchs hold sway over the people.",,{desert},2026-06-15 20:28:26.53607,"{12,18,74,76}",group,,"[{""region"": ""Harondor"", ""probability"": ""Extremely Hard""}, {""region"": ""Mordor"", ""probability"": ""Sheer Folly""}, {""region"": ""Nurn"", ""probability"": ""Sheer Folly""}, {""region"": ""Harithilien"", ""probability"": ""Sheer Folly""}]"
03d5c707-30d6-4ba6-87f5-df56cf6f8cfb,Easterlings,easterlings,humans,all-day,3,"This term refers to a collection of peoples who live in north-central Middle-earth, the area to the east of the western shore of the Sea of Rhûn. These nomadic confederations are ever in search of territory and wealth and periodically invade the lands of their neighbors. The Balchoth and Wainriders are two such peoples. Each group has its own subculture and language, although most are related. Physical Character: Compact and agile. Men average 140 pounds, women 100 pounds. Swarthy, with a tan or yellowish/tan quality. Normal endurance, although they can ride horses, wagons, or chariots for long periods without exhaustion. Short to medium. Men average 5'6"", women 5'1"". Lifespan: Short, about 40-65 years. They are superb with riding animals and produce fabulous horsemen. +10 bonus to Offensive Bonuses when fighting from a horse or chariot. +20 to any attempt to train, befriend, or subdue a horse. They are nomads who live in mobile camps and move their camps using great wagons (wains). Warriors all, they also herd horses and cattle. Easterlings have little regard for anyone except their own people. They hate the Dúnedain.",,{desert},2026-06-15 20:28:26.538843,"{1,2,5,6,15,40,46,59,60,85,86,87}",group,,"[{""region"": ""Angmar"", ""probability"": ""Extremely Hard""}, {""region"": ""Bree"", ""probability"": ""Extremely Hard""}, {""region"": ""Dor Rhunen"", ""probability"": ""Medium""}, {""region"": ""Dorwinion"", ""probability"": ""Very Hard""}, {""region"": ""Eothraim"", ""probability"": ""Medium""}, {""region"": ""Gramuz"", ""probability"": ""Very Hard""}, {""region"": ""Mintyrnath"", ""probability"": ""Absurd""}, {""region"": ""Parth Celebrant"", ""probability"": ""Sheer Folly""}, {""region"": ""South Arthedain"", ""probability"": ""Absurd""}, {""region"": ""South Downs"", ""probability"": ""Absurd""}, {""region"": ""The Shire"", ""probability"": ""Extremely Hard""}, {""region"": ""Tower Hills"", ""probability"": ""Absurd""}]"
b64c6dea-1ac4-44ea-ad56-af303a424eff,Half-orcs,half-orcs,orcs,all-day,3,"Half-orcs are a hideous creation, born of Man and Orc. They are often confused with Uruk-hai, but are a distinct race, small in number but capable and deadly. Their origin is also unclear, although it appears that they were first used by the tainted Wizard Saruman. He still employs them as agents, spies, lieutenants, and special guards. They are particularly effective in Eriador, for Saruman's Half-orcs have Dunlending blood in them and are capable of blending into their societies. Half-orcs are akin to Uruk-hai, but look more like dark Men. They speak Westron quite well (Rank 5), and most know both Orkish (Rank 3) and a little Black Speech (Rank 2). Half-orcs have no restrictions on professions, and get three background points.",,,2026-06-15 20:28:26.545027,"{72,74,83}",group,,"[{""region"": ""Mordor"", ""probability"": ""Hard""}, {""region"": ""Dor Guldur"", ""probability"": ""Hard""}, {""region"": ""Dunland"", ""probability"": ""Sheer Folly""}]"
bdb8190e-09bf-451c-836b-72ee6fcb1710,Uruk-hai,uruk-hai,orcs,all-day,4,"Following Sauron's resurrection in T.A. 1000 he began breeding a new race of Orcs, one capable of independent and intelligent action. After centuries of work, he produced the first Greater Orcs, and he called them the Uruk-hai (BS ""Orc-race"") because they were more suited to the formation of societies. Initially, the Uruk-hai remained close to Sauron and served as lieutenants and elite guards, but gradually their numbers grew and their strain strengthened. Their existence remained guarded until Sauron was willing to show his hand. Nonetheless, in T.A. 2475 they were unleashed in full scale battle formations. They are the Dark Lord's finest goblin troops. The Uruk-hai differ from normal or Lesser Orcs in many ways: (1) they stand 5-6 feet tall; (2) they have a more ""human"" appearance, despite cat-like eyes, fang-teeth, and black/grey hides; (3) they have longer, stronger, and straighter legs; (4) they are intelligent and cunning; and (5) despite their preference for darkness, they operate freely in daylight. They speak Black Speech (Rank 5), Orkish (Rank 4), and good Westron (Rank 4).",,,2026-06-15 20:28:26.544619,{74},group,,"[{""region"": ""Mordor"", ""probability"": ""Medium""}]"
3ef3eb9f-d0d0-41a0-af90-b4387492b1f4,Haradrim,haradrim,humans,all-day,0,"This is a collective name for the peoples who occupy the great arid and semi-arid lands south of Harondor and Mordor, the land called Harad. Since this is rough and unblessed territory, their greatest populations lie beside the seacoast, rivers, and bays; however, Harad contains little true desert and sparse groups settle or roam the whole region. Haradrim (S. ""Southmen"") are also called ""Southrons"" or ""Haradwaith"" (a term also referring to the land). Physical Character: North and central desert - Most groups are small and wiry, particularly those of the open country: males average 130 pounds, women 100 pounds. Coastal areas and Far Harad- Most are related to the Men of Mûmakan, and are tall and wiry: males average 180 pounds, women 140 pounds. Northern groups have light/medium grey or brown skin, straight black hair, and dark brown eyes. Southern groups have dark grey, brown, or black skin; straight or curly black hair; and dark brown or black eyes. +10 bonus versus heat/fire attacks; -10 bonus versus cold/ice attacks. Their eyes are attuned to extremely bright light and they are unaffected by brilliant displays which might blind others.",,{desert},2026-06-15 20:28:26.539264,"{7,11,13,19,20,23,29,75,77,78,79}",group,,"[{""region"": ""Andrast"", ""probability"": ""Very Hard""}, {""region"": ""Anfalas"", ""probability"": ""Sheer Folly""}, {""region"": ""Anorien"", ""probability"": ""Absurd""}, {""region"": ""Belegaer sea"", ""probability"": ""Very Hard""}, {""region"": ""Dor-en-Emyl"", ""probability"": ""Sheer Folly""}, {""region"": ""Druwaith Laur"", ""probability"": ""Absurd""}, {""region"": ""Hairavercien"", ""probability"": ""Absurd""}, {""region"": ""Lamedon"", ""probability"": ""Absurd""}, {""region"": ""Lebennin"", ""probability"": ""Absurd""}, {""region"": ""Tolfalas"", ""probability"": ""Very Hard""}, {""region"": ""Forithilien"", ""probability"": ""Medium""}]"
8c4625b3-a0dc-44c5-bec9-cdee3f87d3da,Slaves,slaves,humans,all-day,3,"Captives and subjugated people from various backgrounds who work the land to support the warrior elite, although the harsh climate forces some warriors to continue agricultural labor.",,{roads},2026-06-16 22:58:58.653695,"{46,66,76}",encounter,811a8823-2b50-4b2c-8a99-8414b6283c06,"[{""region"": ""Forovirian"", ""probability"": ""Medium""}, {""region"": ""Nurn"", ""probability"": ""Medium""}, {""region"": ""Angmar"", ""probability"": ""Medium""}]"
b7757f56-109f-4cfb-bb1e-4e5b8000ff86,Woses,woses,humans,all-day,0,"Of all Men, none surpass the Woses in the arts of wood-lore and wood-craft. This very ancient and diminutive race has long been tied to the forests and has remained the greatest lot of woodland warriors ever produced by the Second-born. Their skills have in fact guarded their narrow survival, for they are considered ugly by Men and Elves alike and have been hunted and persecuted since the days of the First Age. The Woses have many names. What they call themselves is not altogether clear, although the name Drûgs is taken from their own tongue. Drúedain (sing. Drúadan) is the label given them by the Elves, while Men call them by various labels: Rógin (sing. ""Róg""), Púkelmen, Wild Men, or Woses, the latter a Westron term. Orcs fear the Woses, and have named them Oghor-hai. Physical Character: Woses generally have a broad, stumpy profile marked by wide faces, flat features, and deep-set eyes. Short, thick legs, heavy lower bodies, and pronounced brows help give them an eerie character. Ruddy skin, black hair, and black eyes. 4 to 5 feet. Lifespan: 30-50 years. The wide noses of the Woses are the most sensitive found in Man. Even in an open field, they can smell an Orc before another Man can see him. +25 bonus to Tracking maneuvers; +15 bonus for Foraging. They have the ability to sit for days on end without movement. Woses are blessed with superb night-vision. Even in the dark forest of the night they can see 1000 feet as if it were daylight.",,,2026-06-15 20:28:26.544323,"{7,9,11,13,14,16,17,21,23,36,39,62,63,68,72,77,82}",encounter,,"[{""region"": ""Anfalas"", ""probability"": ""Absurd""}, {""region"": ""Druwaith Laur"", ""probability"": ""Medium""}, {""region"": ""Anorien"", ""probability"": ""Medium""}, {""region"": ""Dunland"", ""probability"": ""Medium""}, {""region"": ""Druadan Forest"", ""probability"": ""Medium""}, {""region"": ""Lebennin"", ""probability"": ""Medium""}, {""region"": ""Westmarch"", ""probability"": ""Medium""}, {""region"": ""Enedhwaith"", ""probability"": ""Medium""}, {""region"": ""Tolfalas"", ""probability"": ""Medium""}, {""region"": ""Rohan"", ""probability"": ""Medium""}, {""region"": ""Wold"", ""probability"": ""Medium""}, {""region"": ""Central Misty Mountains"", ""probability"": ""Absurd""}, {""region"": ""Fangorn"", ""probability"": ""Absurd""}, {""region"": ""North Misty Mountains"", ""probability"": ""Absurd""}, {""region"": ""Ronen-in-Anduin"", ""probability"": ""Absurd""}, {""region"": ""Minhiriath"", ""probability"": ""Absurd""}, {""region"": ""Rast Vorn"", ""probability"": ""Hard""}]"
a288de43-4070-432e-abe8-539f969b0ee4,Mithrim Noldor Patrol,mithrim_noldor_patrol,elves,all-day,1,"A roving war-band of Noldor of Mithrim descent that keeps the old marches of the Blue Mountains and northern Lindon. They watch the passes of the Ered Luin and the wooded vales below for Orcs out of the ruined North, and escort travellers between the scattered Elven settlements.",,{roads},2026-06-10 13:23:21.788595,"{22,27,34,52,64}",encounter,aa6753b4-ba46-47b2-88cc-3e0d23036707,"[{""region"": ""Apariach"", ""probability"": ""Medium""}, {""region"": ""Celanoriand"", ""probability"": ""Hard""}, {""region"": ""Ered Luin"", ""probability"": ""Hard""}, {""region"": ""Ered Luin Vales"", ""probability"": ""Hard""}, {""region"": ""Tol Fuin"", ""probability"": ""Hard""}]"
bcf9bf2a-fca1-49d8-b540-a0e0777a047e,Lossoth,lossoth,humans,all-day,0,"The Lossoth live in the Far North of western Middle-earth and are often called ""Snowmen"" or ""Forodwaith"" (the latter is also a name for their land). They are a sparsely settled, nomadic folk who move with the seasonal migrations of big game and rarely interact with other Men. Physical Character: Stocky and hard, with pronounced muscles. They have wide features and large, pudgy hands and feet. Men average 175 pounds, women 140 pounds. Fair, with reddish highlights. They have pale blue eyes and fair hair. They are extremely rugged and can travel great distances with little or no rest. Short; men average 5'5"", women 5'3"". Lifespan: Medium, about 75-90 years. +20 bonus versus cold/ice attacks. -20 bonus versus heat/fire attacks. They have an acute sense of smell and perception. They can pick up a Man's scent a mile downwind and 100 feet upwind (1000 feet otherwise). +10 bonus to Perception. The Lossoth are poor, nomadic hunters and gatherers. They use stonework, bone, and limited amounts of wood and metal (mostly copper). Some herd reindeer and all make use of hunting dogs. They hate Wargs, Dragons, Giants, and Trolls above all things.",,,2026-06-15 20:28:26.539652,"{2,25,54,59,67,73,85,87}",group,,"[{""region"": ""Dorwinion"", ""probability"": ""Absurd""}, {""region"": ""Gramuz"", ""probability"": ""Absurd""}, {""region"": ""Talath Uichel"", ""probability"": ""Medium""}, {""region"": ""Forochel"", ""probability"": ""Medium""}, {""region"": ""The Shire"", ""probability"": ""Medium""}, {""region"": ""Talath Muil"", ""probability"": ""Medium""}, {""region"": ""Dale"", ""probability"": ""Medium""}, {""region"": ""South Downs"", ""probability"": ""Medium""}]"
0cfdd809-57a5-4426-9a95-d7de089d4e51,Falathrim (Sea-elves),falathrim,elves,all-day,0,"Sea-elves who dwell by the coasts, skilled in shipbuilding and sailing. Along the shores of Lindon and Harlindon they appear as fishers and net-menders in the river-mouths, as shipwrights and sea-captains in the havens, and as the crews of the grey ships that keep the western coasts.",,{water},2026-06-15 23:38:31.709241,"{26,28,30,31,33,49,51,52,53,64,65,86}",encounter,57650ea6-8999-4bf1-acc9-b32b4e23230d,"[{""region"": ""Apariach"", ""probability"": ""Medium""}, {""region"": ""Ardquetto"", ""probability"": ""Medium""}, {""region"": ""Vinyalas"", ""probability"": ""Medium""}, {""region"": ""Ascahiriand"", ""probability"": ""Medium""}, {""region"": ""Mänoriand"", ""probability"": ""Medium""}, {""region"": ""Celanoriand"", ""probability"": ""Medium""}, {""region"": ""Sandariand"", ""probability"": ""Medium""}, {""region"": ""Bree"", ""probability"": ""Medium""}, {""region"": ""Ronalindon"", ""probability"": ""Medium""}, {""region"": ""Ardolyalinya"", ""probability"": ""Medium""}, {""region"": ""Lairiardhon"", ""probability"": ""Medium""}, {""region"": ""Lildardhon"", ""probability"": ""Medium""}]"
5aaceb51-4a0c-4606-9177-509739bc187a,Urban Men,urban_men,humans,all-day,0,"This is a generalized label for the town and city folk of Eriador and Gondor, the Common Men of northwestern Middle-earth. It includes common folk from Annúminas, Fornost, Bree, Tharbad, Calembel, Dol Amroth, Linhir, Pelargir, Osgiliath, Minas Tirith, etc. These folk contain varying degrees of Harnadan, Dunlending, Northman, and Dúnadan blood. Physical Character: All types, but normally medium. Males average 160 pounds, women 125 pounds. Variations of fair to tan or olive skin. All colors of hair and eyes. Average endurance. Males average 5'10"", women 5'4"". Lifespan: Moderate, averaging 65-85 years. Various types of elaborate or practical wool and linen garb, including cloaks, boots, etc. Tunics are worn in warmer areas; shirts and pants or leggings are worn in cooler locales. Some imported silks and fine cottons are in evidence. Urban folk are a varied, rather cosmopolitan lot. Many are from mercantile or guild backgrounds and some have dealt with enchantments. Urban folk are worldly enough to deal with most outsiders. They hate no race, aside from the Orcs and Wargs.",,,2026-06-15 20:28:26.541568,"{1,2,6,86,87}",encounter,811a8823-2b50-4b2c-8a99-8414b6283c06,"[{""region"": ""Dor Rhunen"", ""probability"": ""Absurd""}, {""region"": ""Dorwinion"", ""probability"": ""Hard""}, {""region"": ""Eothraim"", ""probability"": ""Absurd""}, {""region"": ""Gramuz"", ""probability"": ""Extremely Hard""}, {""region"": ""Bree"", ""probability"": ""Medium""}]"
227f3bd4-75f2-42ce-890e-e03e816d45b3,Bree-landers,bree-landers,humans,all-day,0,"Mixed folk of Bree and its environs, including men of various stocks and hobbits, living in and around a trenched, hedged village at the junction of the Greenway and Great East Road, once a vibrant trade-town but fading by T.A. 1640.[file:25]",,,2026-06-16 22:58:58.653695,"{15,61,85,86}",encounter,811a8823-2b50-4b2c-8a99-8414b6283c06,"[{""region"": ""The Shire"", ""probability"": ""Medium""}, {""region"": ""Weather Hills"", ""probability"": ""Medium""}, {""region"": ""Bree"", ""probability"": ""Medium""}, {""region"": ""South Arthedain"", ""probability"": ""Medium""}]"
58964860-bbd7-4604-a4dd-fc3528f406bf,Dorwinrim,dorwinrim,humans,all-day,0,"The Dorwinrim occupy the lower Carnen valley and the region running south from the river to the northwest shore of the Sea of Rhûn - the land called Dorwinion. They are a mixture of Northman and Easterling stock. Physical Character: Dorwinrim are slightly larger than most groups labeled as ""Common Men"": males average 160 pounds, females 110 pounds. Overall, they are somewhat stocky and have wide features; narrow noses and eye slits are the only exception. Their fair, slightly yellowish complexion is unique. They have subdued eyes which are usually brown (like their straight hair), although some are blue or green. Average endurance. Men average 5'9"", women 5'2"". Lifespan: 60-80 years. +30 bonus to RR versus poisons. +15 for Acting or Public Speaking situations. +10 for Rowing maneuvers. They are traders and river-men who abandoned their nomadic past in favor of an urban, albeit rustic life. Dorwinion is known for its fine wines and strong oils. Vines cover the land and provide the principal sources of income: grapes, olives, wine, olive oil, etc.",,,2026-06-15 20:28:26.536973,{87},encounter,06d62e06-9fcb-4dda-93c8-9ca72b211f57,"[{""region"": ""Dorwinion"", ""probability"": ""Medium""}]"
811a8823-2b50-4b2c-8a99-8414b6283c06,Common Men,common_men,humans,all-day,0,"A broad label for the Common Men of Eriador and Gondor: the rural and urban folk of mixed stock who make up the bulk of the ordinary population, including farmers, herders, townsfolk, traders and the rootless roles of road and frontier. They are not a single lineage but the everyday people among whom the older Edain, Dunedain and Dunnish bloodlines have long mingled.",,,2026-06-17 01:54:59.319393,"{7,10,11,15,16,19,21,25,35,38,59,61,62,63,72,81,85,86}",group,,"[{""region"": ""Bree"", ""probability"": ""Light""}, {""region"": ""The Shire"", ""probability"": ""Light""}, {""region"": ""South Arthedain"", ""probability"": ""Light""}, {""region"": ""Weather Hills"", ""probability"": ""Light""}, {""region"": ""South Downs"", ""probability"": ""Light""}, {""region"": ""Minhiriath"", ""probability"": ""Light""}, {""region"": ""Enedhwaith"", ""probability"": ""Light""}, {""region"": ""Dunland"", ""probability"": ""Light""}, {""region"": ""Lone-lands"", ""probability"": ""Light""}, {""region"": ""Central Anduin"", ""probability"": ""Light""}, {""region"": ""Nan Anduin"", ""probability"": ""Light""}, {""region"": ""Dale"", ""probability"": ""Light""}, {""region"": ""Esgaroth"", ""probability"": ""Light""}, {""region"": ""Rohan"", ""probability"": ""Light""}, {""region"": ""Wold"", ""probability"": ""Light""}, {""region"": ""Anorien"", ""probability"": ""Light""}, {""region"": ""Lebennin"", ""probability"": ""Light""}, {""region"": ""Lamedon"", ""probability"": ""Light""}]"
365fe1c9-6aca-4ddb-afe9-1425ac312e54,Avalanche,avalanche,hazards,all-day,3,"A sudden slide of snow or rock down a steep slope, triggered by thaw, storm or a careless noise, that can bury a party in moments. The high passes are most treacherous in spring and after heavy snow.",,,2026-06-10 13:23:21.73539,"{24,35,36,39,67,68,72,74,82}",encounter,,"[{""region"": ""Central Anduin"", ""probability"": ""Absurd""}, {""region"": ""Central Misty Mountains"", ""probability"": ""Absurd""}, {""region"": ""Dunland"", ""probability"": ""Sheer Folly""}, {""region"": ""Fangorn"", ""probability"": ""Extremely Hard""}, {""region"": ""North Misty Mountains"", ""probability"": ""Absurd""}, {""region"": ""Ronen-in-Anduin"", ""probability"": ""Absurd""}, {""region"": ""Iron Hills"", ""probability"": ""Sheer Folly""}, {""region"": ""Mordor"", ""probability"": ""Absurd""}, {""region"": ""Talath Uichel"", ""probability"": ""Sheer Folly""}]"
a7960e0e-d0a3-48e2-b1c9-76e4c5949413,Asdriag & Sagath Soldiers,asdriags_and_sagath_soldiers,humans,all-day,3,"Warriors of the Asdriag and Sagath, Easterling tribes of the lands beyond Rhûn who serve Sauron's banners as auxiliaries. Horse-borne and lightly armed, they fight for plunder and the promises of dark lords, and trouble the eastern bounds of the free realms.",,"{roads,desert}",2026-06-10 13:23:21.734365,{83},encounter,03d5c707-30d6-4ba6-87f5-df56cf6f8cfb,"[{""region"": ""Dor Guldur"", ""probability"": ""Extremely Hard""}]"
6b565212-22a4-4b01-acf7-2807e7238e4b,Crocodiles,crocodiles,reptiles,day,3,"Large water-lurking reptiles of the warm southern rivers, marshes and shores, lying like logs until prey comes near. Powerful and armoured, a big one can drag down a deer, a horse or an unwary man.",,,2026-06-10 13:23:21.748906,"{16,17}",encounter,,"[{""region"": ""Minhiriath"", ""probability"": ""Absurd""}, {""region"": ""Rast Vorn"", ""probability"": ""Sheer Folly""}]"
1709ce8b-56ae-48dc-a3f7-ed31708fd6fb,Beijabar of Nan Anduin,beijabar_of_nan_anduin,humans,all-day,0,"The Beijabar, a Northman folk of the Vales of Anduin akin to the Beornings — bee-keepers, herders and woodsmen who hold the riverlands and fight to keep them clear of Orcs and wolves. Independent, and hospitable to friends but fierce to foes.",,{marsh},2026-06-10 13:23:21.740556,"{3,37}",encounter,06d62e06-9fcb-4dda-93c8-9ca72b211f57,"[{""region"": ""Mirkwood Wilds"", ""probability"": ""Extremely Hard""}, {""region"": ""Woodmen"", ""probability"": ""Medium""}]"
05431549-7db3-4991-b944-bb1909f678c5,Calenardhon Ruins,calenardhon_ruins,sites,all-day,1,"The ruins of Calenardhon, the grassland province of Gondor before it became Rohan — abandoned forts, road-stations and steadings standing empty on the plains, slowly reclaimed by grass and weather.",,,2026-06-10 13:23:21.743126,"{5,82}",encounter,,"[{""region"": ""Fangorn"", ""probability"": ""Sheer Folly""}, {""region"": ""Parth Celebrant"", ""probability"": ""Very Hard""}]"
