id,name,slug,type,active,danger,description,url_path,biomes,created_at,region_ids,tier,parent_id,probability_by_region
a2dd5045-97d5-4ee9-b6b5-db32b00378ea,Pirates,pirates,humans,all-day,3,"Sea-raiders who prey on coastal shipping and settlements, putting in to plunder and slipping away with their spoil. Lawless and dangerous, they range the western and southern coasts, sometimes in league with the Corsairs of Umbar, sometimes for themselves alone.",,{water},2026-06-10 13:23:21.801687,"{16,19,20,23,29}",encounter,811a8823-2b50-4b2c-8a99-8414b6283c06,"[{""region"": ""Minhiriath"", ""probability"": ""Absurd""}, {""region"": ""Belegaer sea"", ""probability"": ""Sheer Folly""}, {""region"": ""Dor-en-Emyl"", ""probability"": ""Absurd""}, {""region"": ""Lamedon"", ""probability"": ""Absurd""}, {""region"": ""Tolfalas"", ""probability"": ""Sheer Folly""}]"
a4b1aa2b-a17b-4a91-ae1c-664acde439e9,Sea Captain Sailor,sea_captain_sailor,elves,all-day,0,"An Elven ship-master of Cirdan's folk, commanding one of the grey vessels that ply the Gulf of Lhun and the coasts of Harlindon. Long-sighted and sea-hardened, such captains carry messages, goods and passengers between the havens — and, at the last, those bound west.",,{water},2026-06-10 13:23:21.805756,"{26,28,32,33,49,51,53}",encounter,,"[{""region"": ""Ardolyalinya"", ""probability"": ""Very Hard""}, {""region"": ""Ardquetto"", ""probability"": ""Very Hard""}, {""region"": ""Ascahiriand"", ""probability"": ""Very Hard""}, {""region"": ""Mänoriand"", ""probability"": ""Very Hard""}, {""region"": ""Ronalindon"", ""probability"": ""Very Hard""}, {""region"": ""Sandariand"", ""probability"": ""Very Hard""}, {""region"": ""South Harlindon"", ""probability"": ""Very Hard""}]"
c74a5339-1b6f-481a-9705-a85cad456d93,Scouts,scouts,humans,all-day,0,"Lightly-armed men ranging ahead of a larger force or watching a stretch of country — outriders, foresters and trackers in someone's service. They keep out of sight, mark the movements of friend and foe, and carry word swiftly back.",,{roads},2026-06-10 13:23:21.805582,"{48,54,55,56,57,61,73,81}",encounter,811a8823-2b50-4b2c-8a99-8414b6283c06,"[{""region"": ""Evendim Hills"", ""probability"": ""Very Hard""}, {""region"": ""Fornost"", ""probability"": ""Hard""}, {""region"": ""Forochel"", ""probability"": ""Sheer Folly""}, {""region"": ""Lone-lands"", ""probability"": ""Medium""}, {""region"": ""Numeriador"", ""probability"": ""Very Hard""}, {""region"": ""Rammas Formen"", ""probability"": ""Hard""}, {""region"": ""Talath Muil"", ""probability"": ""Medium""}, {""region"": ""Weather Hills"", ""probability"": ""Medium""}]"
4497c8ad-6b95-489d-9e89-f37c40390dcd,Serganka,serganka,flying_animals,day,0,"A rare bird of the eastern wilds, prized and little understood, met only in remote country. Wary and striking in plumage, it keeps far from the haunts of Men.",,,2026-06-10 13:23:21.806026,"{41,42,43}",encounter,,"[{""region"": ""En Egladil"", ""probability"": ""Absurd""}, {""region"": ""Trollshaws"", ""probability"": ""Very Hard""}, {""region"": ""West Rhudaur"", ""probability"": ""Sheer Folly""}]"
9b28ea4a-ab57-444e-b488-2de8ee4a852b,Rivermen,rivermen,humans,all-day,0,"Men who live and work along the great rivers — boatmen, ferriers, fishers and traders who move goods and folk by water. They know every shoal, landing and backwater, and keep a shrewd independence from the lords of the dry land.",,{water},2026-06-10 13:23:21.804813,"{15,17,21,40,58,85,86}",encounter,811a8823-2b50-4b2c-8a99-8414b6283c06,"[{""region"": ""Bree"", ""probability"": ""Hard""}, {""region"": ""Enedhwaith"", ""probability"": ""Sheer Folly""}, {""region"": ""Old Forest"", ""probability"": ""Extremely Hard""}, {""region"": ""Rast Vorn"", ""probability"": ""Absurd""}, {""region"": ""South Arthedain"", ""probability"": ""Sheer Folly""}, {""region"": ""The Shire"", ""probability"": ""Hard""}, {""region"": ""Tower Hills"", ""probability"": ""Extremely Hard""}]"
910f4091-91e3-49b8-938c-8f00436dd429,Sheep,sheep,herbivores,all-day,0,"Domestic and feral sheep, raised across the settled lands for wool, milk and meat and run half-wild in rougher country. Timid and herd-bound, they are easy prey for wolves and a common target of raiders.",,,2026-06-10 13:23:21.806801,"{1,2,3,4,5,6,7,8,9,10,11,12,13,14,15,16,17,18,19,20,21,22,23,24,25,28,30,31,33,35,36,37,38,39,40,41,42,43,44,45,46,48,49,50,51,52,53,54,55,56,57,58,59,60,61,62,63,64,65,66,67,68,69,70,71,72,73,74,75,76,77,78,79,80,81,82,83,85,86}",encounter,,"[{""region"": ""Bree"", ""probability"": ""Very Hard""}, {""region"": ""Old Forest"", ""probability"": ""Extremely Hard""}, {""region"": ""South Arthedain"", ""probability"": ""Very Hard""}, {""region"": ""The Shire"", ""probability"": ""Very Hard""}, {""region"": ""Tower Hills"", ""probability"": ""Sheer Folly""}, {""region"": ""Lamedon"", ""probability"": ""Light""}, {""region"": ""Central Anduin"", ""probability"": ""Light""}, {""region"": ""Fangorn"", ""probability"": ""Light""}, {""region"": ""North Misty Mountains"", ""probability"": ""Light""}, {""region"": ""Mänoriand"", ""probability"": ""Light""}, {""region"": ""Tol Fuin"", ""probability"": ""Light""}, {""region"": ""Mirkwood Wilds"", ""probability"": ""Light""}, {""region"": ""Andrast"", ""probability"": ""Light""}, {""region"": ""Ronen-in-Anduin"", ""probability"": ""Light""}, {""region"": ""Dor Guldur"", ""probability"": ""Light""}, {""region"": ""South Downs"", ""probability"": ""Light""}, {""region"": ""Wilderness of Arnor"", ""probability"": ""Light""}, {""region"": ""Central Misty Mountains"", ""probability"": ""Light""}, {""region"": ""Eothraim"", ""probability"": ""Light""}, {""region"": ""Gramuz"", ""probability"": ""Light""}, {""region"": ""Westmarch"", ""probability"": ""Light""}, {""region"": ""Lone-lands"", ""probability"": ""Light""}, {""region"": ""Mordor"", ""probability"": ""Light""}, {""region"": ""Tolfalas"", ""probability"": ""Light""}, {""region"": ""Dagorlad"", ""probability"": ""Light""}, {""region"": ""Iron Hills"", ""probability"": ""Light""}, {""region"": ""Nurn"", ""probability"": ""Light""}, {""region"": ""Druadan Forest"", ""probability"": ""Light""}, {""region"": ""Wold"", ""probability"": ""Light""}, {""region"": ""Woodmen"", ""probability"": ""Light""}, {""region"": ""Ardquetto"", ""probability"": ""Light""}, {""region"": ""Parth Celebrant"", ""probability"": ""Light""}, {""region"": ""Forochel"", ""probability"": ""Light""}, {""region"": ""Apariach"", ""probability"": ""Light""}, {""region"": ""Lairiardhon"", ""probability"": ""Light""}, {""region"": ""Lildardhon"", ""probability"": ""Light""}, {""region"": ""Evendim Hills"", ""probability"": ""Light""}, {""region"": ""Vinyalas"", ""probability"": ""Light""}, {""region"": ""Forovirian"", ""probability"": ""Light""}, {""region"": ""Rast Vorn"", ""probability"": ""Light""}, {""region"": ""Coldfells"", ""probability"": ""Light""}, {""region"": ""En Egladil"", ""probability"": ""Light""}, {""region"": ""En Udanoriath"", ""probability"": ""Light""}, {""region"": ""Ettenmoors"", ""probability"": ""Light""}, {""region"": ""Rivendell"", ""probability"": ""Light""}, {""region"": ""Trollshaws"", ""probability"": ""Light""}, {""region"": ""Forithilien"", ""probability"": ""Light""}, {""region"": ""Rohan"", ""probability"": ""Light""}, {""region"": ""West Rhudaur"", ""probability"": ""Light""}, {""region"": ""Harithilien"", ""probability"": ""Light""}, {""region"": ""Numeriador"", ""probability"": ""Light""}, {""region"": ""Ascahiriand"", ""probability"": ""Light""}, {""region"": ""Eregion"", ""probability"": ""Light""}, {""region"": ""Sandariand"", ""probability"": ""Light""}, {""region"": ""Talath Muil"", ""probability"": ""Light""}, {""region"": ""Anfalas"", ""probability"": ""Light""}, {""region"": ""Rammas Formen"", ""probability"": ""Light""}, {""region"": ""Angmar"", ""probability"": ""Light""}, {""region"": ""Talath Uichel"", ""probability"": ""Light""}, {""region"": ""Ardolyalinya"", ""probability"": ""Light""}, {""region"": ""Celanoriand"", ""probability"": ""Light""}, {""region"": ""Dunland"", ""probability"": ""Light""}, {""region"": ""Minhiriath"", ""probability"": ""Light""}, {""region"": ""Druwaith Laur"", ""probability"": ""Light""}, {""region"": ""Mintyrnath"", ""probability"": ""Light""}, {""region"": ""Hairavercien"", ""probability"": ""Light""}, {""region"": ""Dale"", ""probability"": ""Light""}, {""region"": ""Lebennin"", ""probability"": ""Light""}, {""region"": ""Harondor"", ""probability"": ""Light""}, {""region"": ""Esgaroth"", ""probability"": ""Light""}, {""region"": ""Anorien"", ""probability"": ""Light""}, {""region"": ""Enedhwaith"", ""probability"": ""Light""}, {""region"": ""Nan Anduin"", ""probability"": ""Light""}, {""region"": ""Fornost"", ""probability"": ""Light""}, {""region"": ""Woodland Realm"", ""probability"": ""Light""}, {""region"": ""Dor-en-Emyl"", ""probability"": ""Light""}, {""region"": ""Weather Hills"", ""probability"": ""Light""}, {""region"": ""Moria"", ""probability"": ""Light""}, {""region"": ""Dor Rhunen"", ""probability"": ""Light""}]"
a626cd0a-8545-4aa1-b143-116c6cd7d910,Sand glass storm,sand_glass_storm,hazards,all-day,2,"A blinding storm of wind-driven sand and grit that scours skin, chokes the lungs and erases the trail, common in the southern deserts. It can rob a caravan of its bearings and bury landmarks in hours.",,,2026-06-10 13:23:21.805433,{76},encounter,,"[{""region"": ""Nurn"", ""probability"": ""Absurd""}]"
110d79f1-e19e-45f0-9ba2-9b740d8b675b,Sailors,sailors,humans,all-day,0,"Seafaring and river-going men met in port or aboard ship — crewing trade-vessels, fishing boats and ferries. Hardy, superstitious and free with a tale, they know the coasts, currents and harbours of their waters.",,{water},2026-06-10 13:23:21.805275,"{16,17}",encounter,811a8823-2b50-4b2c-8a99-8414b6283c06,"[{""region"": ""Minhiriath"", ""probability"": ""Absurd""}, {""region"": ""Rast Vorn"", ""probability"": ""Absurd""}]"
032b0db0-3ce3-44d2-aabc-1c5f95c177d1,Severe Weather,severe_weather,hazards,all-day,2,"Killing weather — blizzards, ice-storms, hail, gales and freezing rain — that can fell the unsheltered traveller through cold and exhaustion alone. The high country and far North are deadliest when the sky turns.",,,2026-06-10 13:23:21.80666,"{16,17,59,60}",encounter,,"[{""region"": ""Minhiriath"", ""probability"": ""Sheer Folly""}, {""region"": ""Mintyrnath"", ""probability"": ""Absurd""}, {""region"": ""Rast Vorn"", ""probability"": ""Absurd""}, {""region"": ""South Downs"", ""probability"": ""Absurd""}]"
583dedb1-f86c-4c23-8b0c-5b5adfae70ee,Sindar Guardian,sindar_guardian,elves,all-day,1,"A Sindarin warden set to keep some threshold of the Elven lands — a ford, a forest-eaves, a hidden path. Silent and watchful, clad to melt into wood and shadow, the guardian challenges intruders and speeds friends quietly on their way.",,,2026-06-10 13:23:21.807267,{64},encounter,57650ea6-8999-4bf1-acc9-b32b4e23230d,"[{""region"": ""Apariach"", ""probability"": ""Medium""}]"
d4dda60f-0d5e-4e83-b204-e7660d77cf08,Slaves and Guards,slaves_and_guards,humans,all-day,3,"A coffle of slaves driven under armed guard — captives bound for the markets or the labor of some master, herded along the road by hard-eyed keepers. The guards are watchful and brutal; the slaves, broken but always alert for a chance to flee.",,{roads},2026-06-10 13:23:21.807947,{46},encounter,811a8823-2b50-4b2c-8a99-8414b6283c06,"[{""region"": ""Angmar"", ""probability"": ""Extremely Hard""}]"
1c5bd70e-4d0a-4572-850c-cd2deb200b57,Southerners,southerners,humans,all-day,0,"Men of the southern lands — Haradrim and their neighbours, dark-haired and richly or strangely arrayed — met as traders, envoys, mercenaries or soldiers far north of their homes, and often eyed with mistrust in the lands of the West.",,{roads},2026-06-10 13:23:21.809565,"{15,16,17,21,40,58,59,60}",encounter,3ef3eb9f-d0d0-41a0-af90-b4387492b1f4,"[{""region"": ""Enedhwaith"", ""probability"": ""Extremely Hard""}, {""region"": ""Minhiriath"", ""probability"": ""Sheer Folly""}, {""region"": ""Mintyrnath"", ""probability"": ""Absurd""}, {""region"": ""Old Forest"", ""probability"": ""Very Hard""}, {""region"": ""Rast Vorn"", ""probability"": ""Absurd""}, {""region"": ""South Arthedain"", ""probability"": ""Absurd""}, {""region"": ""South Downs"", ""probability"": ""Absurd""}, {""region"": ""Tower Hills"", ""probability"": ""Sheer Folly""}]"
1a1721ea-238d-42ba-a523-9aa2e148b016,Snow Leopard,snow_leopard,carnivores,all-day,2,"A solitary, grey-dappled cat of the high cold peaks, superbly suited to crag and snow. A patient stalker of goats and sheep among the heights, shy of Men and rarely seen in the lowlands.",,,2026-06-10 13:23:21.808883,{72},encounter,,"[{""region"": ""Dunland"", ""probability"": ""Absurd""}]"
e5e0867a-3b8b-4aa7-beab-adc879ed0a98,Trolls,trolls,trolls,all-day,4,"Bred by Morgoth in mockery of Ents, Trolls are as tough and stupid as the stone from which they were made. Some feel they are related to Giants. In any case, Trolls hate all other creatures, a legacy of Morgoth's dark touch. Normal Trolls are divided into several types (based on their location): Hill, Cave, Snow, and Stone-trolls. The latter is the most common group. These types all revert to the stone of their substance when exposed to the light of day, for they were created in Darkness and the Sun can unmake them. Physical Character: They are huge and immensely strong, with thick bodies and limbs. Their tough hides have an inconsistent quality; many have overlapping scales and some have body hair. Various shades of brown, green, or grey hide, with black or brown eyes. They have black blood. Average endurance. 9 to 11 feet. Variable lifespan; hundreds of years. Trolls do not understand fear. Their vision is the same as that of Orcs. Sunlight. When exposed to the natural light of day they turn to stone. Trolls live in order to play and eat. To them play means killing and pillaging, and eating means fresh meat - raw or cooked - or jelly made from innards.",,,2026-06-10 13:23:21.81252,"{2,9,14,15,19,20,35,36,39,40,58,68,77,85,86,87}",encounter,,"[{""region"": ""Bree"", ""probability"": ""Sheer Folly""}, {""region"": ""Old Forest"", ""probability"": ""Very Hard""}, {""region"": ""South Arthedain"", ""probability"": ""Absurd""}, {""region"": ""The Shire"", ""probability"": ""Sheer Folly""}, {""region"": ""Tower Hills"", ""probability"": ""Very Hard""}, {""region"": ""Central Anduin"", ""probability"": ""Absurd""}, {""region"": ""Central Misty Mountains"", ""probability"": ""Sheer Folly""}, {""region"": ""Dor-en-Emyl"", ""probability"": ""Sheer Folly""}, {""region"": ""Dorwinion"", ""probability"": ""Absurd""}, {""region"": ""Druadan Forest"", ""probability"": ""Absurd""}, {""region"": ""Druwaith Laur"", ""probability"": ""Absurd""}, {""region"": ""Gramuz"", ""probability"": ""Sheer Folly""}, {""region"": ""Lamedon"", ""probability"": ""Sheer Folly""}, {""region"": ""North Misty Mountains"", ""probability"": ""Sheer Folly""}, {""region"": ""Ronen-in-Anduin"", ""probability"": ""Extremely Hard""}, {""region"": ""Westmarch"", ""probability"": ""Absurd""}]"
34d4c99b-db03-4e67-9d95-5dee9c87fe4b,Small Animals,small_animals,other_animals,all-day,0,"The small creatures of field, hedge and burrow — hares, foxes, squirrels, weasels, mice and the like. Seldom a threat, they are the everyday life of the land and the prey on which larger hunters depend.",,,2026-06-10 13:23:21.808076,"{15,40,58,69}",encounter,,"[{""region"": ""Old Forest"", ""probability"": ""Sheer Folly""}, {""region"": ""South Arthedain"", ""probability"": ""Very Hard""}, {""region"": ""Tower Hills"", ""probability"": ""Very Hard""}, {""region"": ""Wilderness of Arnor"", ""probability"": ""Extremely Hard""}]"
e6cf8151-140f-436a-86e5-892cdb7fbd8c,Thieves & Smugglers,thieves,humans,all-day,3,"Footpads, cutpurses and smugglers who work the towns, fairs and trade-roads, moving stolen goods and contraband, slipping past tolls and gates, and lightening the purses of the unwary. Quick-fingered and quicker to vanish, they answer to whoever pays.",,{roads},2026-06-10 13:23:21.808621,"{8,15,16,17,21,40,41,42,43,58,59,60,85,86}",encounter,811a8823-2b50-4b2c-8a99-8414b6283c06,"[{""region"": ""Bree"", ""probability"": ""Sheer Folly""}, {""region"": ""Old Forest"", ""probability"": ""Extremely Hard""}, {""region"": ""South Arthedain"", ""probability"": ""Absurd""}, {""region"": ""The Shire"", ""probability"": ""Sheer Folly""}, {""region"": ""Tower Hills"", ""probability"": ""Sheer Folly""}, {""region"": ""Enedhwaith"", ""probability"": ""Extremely Hard""}, {""region"": ""Minhiriath"", ""probability"": ""Very Hard""}, {""region"": ""Mintyrnath"", ""probability"": ""Extremely Hard""}, {""region"": ""Rast Vorn"", ""probability"": ""Absurd""}, {""region"": ""South Downs"", ""probability"": ""Extremely Hard""}, {""region"": ""En Egladil"", ""probability"": ""Very Hard""}, {""region"": ""Trollshaws"", ""probability"": ""Sheer Folly""}, {""region"": ""West Rhudaur"", ""probability"": ""Very Hard""}, {""region"": ""Dagorlad"", ""probability"": ""Extremely Hard""}]"
1a12c1c7-53b5-448e-a4e5-148489b9cdcf,Snow-trolls,snow_troll,trolls,all-day,4,"Pale, cold-hardened Trolls of the northern wastes and high snows, ranging Forochel and the frozen reaches. White as the drifts they hunt in and thick-hided against the cold, they are among the few Trolls that brave the daylight of the polar lands.",,{mountains},2026-06-10 13:23:21.809291,"{48,54,55,56,57,61,66,73,81}",encounter,,"[{""region"": ""Forovirian"", ""probability"": ""Extremely Hard""}, {""region"": ""Evendim Hills"", ""probability"": ""Absurd""}, {""region"": ""Fornost"", ""probability"": ""Absurd""}, {""region"": ""Forochel"", ""probability"": ""Very Hard""}, {""region"": ""Lone-lands"", ""probability"": ""Absurd""}, {""region"": ""Numeriador"", ""probability"": ""Absurd""}, {""region"": ""Rammas Formen"", ""probability"": ""Sheer Folly""}, {""region"": ""Talath Muil"", ""probability"": ""Extremely Hard""}, {""region"": ""Weather Hills"", ""probability"": ""Absurd""}]"
9e16042a-4663-4bec-81f9-c27274bddd33,Snow Lions,snow_lions,carnivores,all-day,3,"Pale, thick-furred great cats of the northern mountains and snow-fields, well camouflaged against ice and stone. Powerful ambush hunters of goats, deer and elk, they are seldom seen until they strike.",,,2026-06-10 13:23:21.809008,"{24,67}",encounter,,"[{""region"": ""Iron Hills"", ""probability"": ""Sheer Folly""}, {""region"": ""Talath Uichel"", ""probability"": ""Sheer Folly""}]"
b0849a4e-1db3-4006-86bc-6d3cfd7b7bfd,Tereg Trolls of Dol Guldur,tereg_trolls_of_dol_guldur,trolls,all-day,4,"Trolls kept and bred at Dol Guldur in southern Mirkwood, hardened to the Necromancer's service. Set to guard the hill of sorcery and its approaches, they are crueller and better-handled than wild Trolls, and are loosed on intruders and on the Wood-elves and Woodmen of the southern forest.",,{forest},2026-06-10 13:23:21.810963,{83},encounter,,"[{""region"": ""Dor Guldur"", ""probability"": ""Medium""}]"
91aa42fc-d516-4215-808b-e13614d1ec79,Spiders,spiders,insects,day,2,"The many spiders of wood, cave and ruin, most small and harmless but some grown large and venomous in dark, tainted places. Their webs choke old passages and forest hollows, and the bigger kinds take birds and small beasts.",,,2026-06-10 13:23:21.809949,{74},encounter,,"[{""region"": ""Mordor"", ""probability"": ""Absurd""}]"
503fe564-a868-45ef-b0bf-fd0bbcd066f0,Spies,spies,humans,all-day,2,"Agents abroad on someone's secret business — watching roads and garrisons, carrying word, or worming into the confidence of the powerful. They pass as travellers, merchants or servants, and a careless one is as dangerous to its master as to its mark.",,{roads},2026-06-10 13:23:21.810201,"{7,11,13,15,16,17,19,20,21,23,29,40,41,42,43,58,59,60,77,78,79,85,86}",encounter,811a8823-2b50-4b2c-8a99-8414b6283c06,"[{""region"": ""Bree"", ""probability"": ""Extremely Hard""}, {""region"": ""Old Forest"", ""probability"": ""Absurd""}, {""region"": ""South Arthedain"", ""probability"": ""Very Hard""}, {""region"": ""The Shire"", ""probability"": ""Extremely Hard""}, {""region"": ""Tower Hills"", ""probability"": ""Extremely Hard""}, {""region"": ""Andrast"", ""probability"": ""Absurd""}, {""region"": ""Anfalas"", ""probability"": ""Absurd""}, {""region"": ""Anorien"", ""probability"": ""Absurd""}, {""region"": ""Belegaer sea"", ""probability"": ""Absurd""}, {""region"": ""Dor-en-Emyl"", ""probability"": ""Sheer Folly""}, {""region"": ""Druwaith Laur"", ""probability"": ""Absurd""}, {""region"": ""Enedhwaith"", ""probability"": ""Absurd""}, {""region"": ""Hairavercien"", ""probability"": ""Absurd""}, {""region"": ""Lamedon"", ""probability"": ""Sheer Folly""}, {""region"": ""Lebennin"", ""probability"": ""Absurd""}, {""region"": ""Minhiriath"", ""probability"": ""Absurd""}, {""region"": ""Mintyrnath"", ""probability"": ""Absurd""}, {""region"": ""Rast Vorn"", ""probability"": ""Absurd""}, {""region"": ""South Downs"", ""probability"": ""Absurd""}, {""region"": ""Tolfalas"", ""probability"": ""Absurd""}, {""region"": ""En Egladil"", ""probability"": ""Extremely Hard""}, {""region"": ""Trollshaws"", ""probability"": ""Extremely Hard""}, {""region"": ""West Rhudaur"", ""probability"": ""Extremely Hard""}]"
1743d63f-3886-46b9-88a7-681b8a013343,Tribesmen,tribesmen,humans,all-day,1,"Folk of a clan or tribe living beyond the settled realms — hillmen, marsh-dwellers, herders or hunters bound by kin and custom rather than king. Proud and wary of outsiders, and fierce in defense of their own ground.",,,2026-06-10 13:23:21.811671,"{16,17,21,59,60}",encounter,811a8823-2b50-4b2c-8a99-8414b6283c06,"[{""region"": ""Enedhwaith"", ""probability"": ""Very Hard""}, {""region"": ""Minhiriath"", ""probability"": ""Medium""}, {""region"": ""Mintyrnath"", ""probability"": ""Very Hard""}, {""region"": ""Rast Vorn"", ""probability"": ""Absurd""}, {""region"": ""South Downs"", ""probability"": ""Very Hard""}]"
98af10ef-c579-40c4-87ac-cd10e62e251b,The Witch king,the_witch_king,undead,nocturnal,5,"The Lord of the Nazgul, the Witch-king who ruled the realm of Angmar against the Dunedain of the North and later led Sauron's forces from Minas Morgul; mightiest of the nine Ringwraiths.",,,2026-06-10 13:23:21.811198,"{46,48,55,56,57,74,83}",encounter,,"[{""region"": ""Evendim Hills"", ""probability"": ""Absurd""}, {""region"": ""Fornost"", ""probability"": ""Medium""}, {""region"": ""Numeriador"", ""probability"": ""Absurd""}, {""region"": ""Rammas Formen"", ""probability"": ""Absurd""}, {""region"": ""Angmar"", ""probability"": ""Absurd""}, {""region"": ""Mordor"", ""probability"": ""Absurd""}, {""region"": ""Dor Guldur"", ""probability"": ""Absurd""}]"
34e281a2-2d05-4b55-a9fd-21e9f65874f6,Toads,toads,amphibians,all-day,0,"Frogs, toads and other amphibians of pond, marsh and damp wood, loud in the breeding season and harmless to all but insects. Some marsh-toads carry an acrid skin-poison that sickens any beast foolish enough to mouth them.",,,2026-06-10 13:23:21.811435,"{8,76}",encounter,,"[{""region"": ""Nurn"", ""probability"": ""Absurd""}, {""region"": ""Dagorlad"", ""probability"": ""Extremely Hard""}]"
85d071e3-de44-4d3f-b1de-8e3b0134fd7d,Wandering Company,wandering_company,humans,all-day,0,"A band of folk travelling the roads together — players, pilgrims, displaced families or companions on a long road, sharing fire and protection in numbers. Their fortunes and friendliness vary, but a company on the move always carries news from afar.",,{roads},2026-06-10 13:23:21.81449,"{15,17,21,40,58,59,60,85,86}",encounter,811a8823-2b50-4b2c-8a99-8414b6283c06,"[{""region"": ""Bree"", ""probability"": ""Extremely Hard""}, {""region"": ""Enedhwaith"", ""probability"": ""Absurd""}, {""region"": ""Mintyrnath"", ""probability"": ""Absurd""}, {""region"": ""Old Forest"", ""probability"": ""Absurd""}, {""region"": ""Rast Vorn"", ""probability"": ""Sheer Folly""}, {""region"": ""South Arthedain"", ""probability"": ""Very Hard""}, {""region"": ""South Downs"", ""probability"": ""Absurd""}, {""region"": ""The Shire"", ""probability"": ""Extremely Hard""}, {""region"": ""Tower Hills"", ""probability"": ""Sheer Folly""}]"
ec5bf6f3-dc3a-47a7-9b5c-00e8fdc7feef,War Wolves,war_wolves,carnivores,all-day,2,"Huge dogs (S. Ormaraka, aka Yelmaraka), often mistaken for Wargs, bred and trained for combat and frequently fielded in numbers as trackers, scouts or to harass enemy armies. The War-wolves of Waw serve as combat units, while those of Angmar are used as mounts by Orcish raiders and Orc-lords. They look like merely overlarge Wolves, which is true, but they are bolder, far more violent and much more cunning.",,,2026-06-10 13:23:21.814643,"{2,44,45,46,73,76,87}",encounter,,"[{""region"": ""Dorwinion"", ""probability"": ""Absurd""}, {""region"": ""Gramuz"", ""probability"": ""Absurd""}, {""region"": ""Nurn"", ""probability"": ""Extremely Hard""}, {""region"": ""Angmar"", ""probability"": ""Extremely Hard""}, {""region"": ""Forochel"", ""probability"": ""Extremely Hard""}, {""region"": ""Coldfells"", ""probability"": ""Extremely Hard""}, {""region"": ""Ettenmoors"", ""probability"": ""Extremely Hard""}]"
