id,name,slug,type,active,danger,description,url_path,biomes,created_at,region_ids,tier,parent_id,probability_by_region
84b17a11-a461-4c36-bfbf-15cc779b48ff,Carnantor,carnantor,water_animals,day,0,"Huge ocean-dwelling Eels, the Carnantor (Q. ""Red Maws""; sing. ""Carnanto"") are among the most dangerous of water beasts. They reside in the reefs in the eastern portions of the South Sea (S. ""Haragaer"") and the southern reaches of the East Sea (Q. ""Romenear""), favoring the ample shelter, rich food sources, and warm waters off Endor southeastern coast. These seemingly ever-hungry denizens of the undersea shelf subsist on sharks and other large fish, battling Kraken, Whales, and Fell Turtles for control of the waters. Carnantor are particularly dominant and dangerous in the spring, when the Eels return to their spawning grounds off the coasts of Waw, Cevra, Arth, and Vulm Shryac, crowding the reefs and feeding and mating in an awe-inspiring frenzy. The male is up to 12 feet long, while the female reaches lengths of 45 feet.",,{water},2026-06-15 16:25:44.988887,"{12,29}",encounter,,"[{""region"": ""Belegaer sea"", ""probability"": ""Sheer Folly""}, {""region"": ""Harondor"", ""probability"": ""Sheer Folly""}]"
9c701b1a-07da-4329-8e3d-0829a7b91445,Leech,leech,water_animals,all-day,0,"While lauded for its medicinal qualities in some cultures, the Leech is only considered a nuisance in the delta. These nasty, slug-like creatures fasten to anything warm-blooded and use their serrated tongue to rasp through to a blood vessel. Then they remain fixed to their prey, gorging themselves until they are so full they slip off.",,,2026-06-15 16:25:44.988887,"{11,21,35,38}",encounter,,"[{""region"": ""Central Anduin"", ""probability"": ""Light""}, {""region"": ""Nan Anduin"", ""probability"": ""Light""}, {""region"": ""Lebennin"", ""probability"": ""Light""}, {""region"": ""Enedhwaith"", ""probability"": ""Light""}]"
bfe667d7-574f-4bf6-877e-28daa6d561cf,Vereut Eagles,vereut_eagles,flying_animals,day,0,"The Vereut Eagle inhabits the hills of eastern Eriador. It is black over most of its body and wings, but its hue reaches a dark purple near the face and wing tips. The Eagle beak and eyes stand in stark contrast, for they both are a bright yellow color. When hunting, they fly silently, low to the ground, enabling them to skirt the tops of hills and ridges to surprise their favorite prey: Gophers and Rock Hydrax. This method of hunting is startling to those who are unacquainted with the beasts, and many an Eriadoran has suddenly found himself in a brief, bewildering combat at the crest of a hill. Several Dunlanders wear scars on their faces attesting that these chance meetings can be dangerous.",,{mountains},2026-06-15 16:25:44.988887,"{21,70,72}",encounter,,"[{""region"": ""Eregion"", ""probability"": ""Hard""}, {""region"": ""Dunland"", ""probability"": ""Hard""}, {""region"": ""Enedhwaith"", ""probability"": ""Hard""}]"
18411f42-ef3b-439a-92a1-f644a3b1332c,Hummerhorns,hummerhorns,insects,day,1,"Surely one of Endor's most vicious insects, the rare but often lethal Hummerhorn is the stuff of legend. Each weighs 6-8 lbs and has a razor sharp, pointed proboscis of chitin (transparent horn). It gores a victim to death, then feasts on the corpse with three sets of mandibles. They resemble gigantic black and grey wasps, and their only failing is the noise they make whenever they approach.",,"{forest,mountains}",2026-06-15 20:15:02.092526,"{8,21,38}",encounter,,"[{""region"": ""Nan Anduin"", ""probability"": ""Absurd""}, {""region"": ""Dagorlad"", ""probability"": ""Absurd""}, {""region"": ""Enedhwaith"", ""probability"": ""Absurd""}]"
03d5f579-8640-4f67-a36e-bd157afead50,Black Swans,black_swans,flying_animals,day,0,"Black Swans are found from Mordor and northward into Wilderland, as far as the southern reaches of Mirkwood. They are also quite common in the river valleys of Nurad and Rhovanion, especially along the River Anduin. They are large for Swans and have been known to mob and overturn boats, usually because the vessels had come too close to the Swans' huge nests.",,"{marsh,water}",2026-06-15 20:15:02.140212,"{1,2,6,35,38,74,76,87}",encounter,,"[{""region"": ""Dor Rhunen"", ""probability"": ""Sheer Folly""}, {""region"": ""Eothraim"", ""probability"": ""Sheer Folly""}, {""region"": ""Gramuz"", ""probability"": ""Sheer Folly""}, {""region"": ""Nurn"", ""probability"": ""Very Hard""}, {""region"": ""Central Anduin"", ""probability"": ""Very Hard""}, {""region"": ""Nan Anduin"", ""probability"": ""Very Hard""}, {""region"": ""Mordor"", ""probability"": ""Very Hard""}, {""region"": ""Dorwinion"", ""probability"": ""Very Hard""}]"
719b5373-0c39-492a-9dc8-7d89e393bb1f,Gelyngyl,gelyngyl,insects,day,1,"Gelyngyl (S. ""Green Spiders""; sing. ""Galungol"") are the largest of the so-called ""Animal Spiders""—that is, Spiders that are not monsters. Deep green on top and light green on their undersides, they are difficult to discern in a thick forest. Their coloring, coupled with their arboreal nature, makes them very hard (-20) to discern when they are in their natural habitat. Hiding in dense foliage, the rapacious Galungol hangs above animal trails and other areas where its prey might be active, waiting to drop upon unwary victims. Then it injects a powerful (6th lvl) reduction poison into any soft tissue it can find, immobilizing its potential kill before carrying it off to the Spider's web home. Gelyngyl webs are located in clusters set high in the trees. Unlike most of its relatives, Green Spiders are exceptionally social and are prone to attack and feed in groups of ten or more. Acting in unison, they are capable of surrounding and herding their victims into traps. Each Galungol has a pad on each of its four rear legs, and the Spider can rub its legs together to create the sounds with which it communicates.",,{forest},2026-06-15 16:25:44.988887,"{21,70,82}",encounter,,"[{""region"": ""Eregion"", ""probability"": ""Very Hard""}, {""region"": ""Enedhwaith"", ""probability"": ""Very Hard""}, {""region"": ""Fangorn"", ""probability"": ""Very Hard""}]"
b2b8b6a5-6035-4dc3-a075-2df16bccd61b,Watchers In The Water,watchers_in_the_water,water_creatures,all-day,5,"Freshwater Kraken that normally reside in the pools of the Underdeeps. One emerged into the Sirannon by the West Gate of Moria, damming it into a gloomy lake and, driven by Sauron's hatred, preying on Dwarves and Orcs before it nearly seized Frodo as the Fellowship entered Moria in T.A. 3019.",,"{forest,water}",2026-06-15 16:25:44.988887,{71},encounter,,"[{""region"": ""Moria"", ""probability"": ""Sheer Folly""}]"
98fc5ff6-de02-42d2-8d1c-83c224e0d5f8,Wels,wels,water_animals,all-day,0,"A species of giant catfish, the Wels is an ugly brute. They are usually up to 4-5' long, but sometimes reach 10'. A larger Wels weighs nearly 700 lbs. It has a rounded body with a flattened head and a wide, horizontal mouth, around which are two long sensory barbels and four short ones. Wels are known to swallow prey whole and will sometimes bash boats to see what falls out.",,,2026-06-15 16:25:44.988887,"{11,13,38}",encounter,,"[{""region"": ""Lebennin"", ""probability"": ""Very Hard""}, {""region"": ""Nan Anduin"", ""probability"": ""Very Hard""}, {""region"": ""Anfalas"", ""probability"": ""Very Hard""}]"
3219a6b2-fc87-49ae-9fbf-3d803b36ee0d,Bitterns,bitterns,flying_animals,day,0,"A wading and fishing bird found in the deltas of northwestern Endor, the Bittern, or Northern Heron, is known for its strange resonant, mournful cry. It is a slow, cunning, deliberate hunter that feeds on snakes, crustaceans, and fish. Bitterns migrate, spending their winters in the wetlands along the temperate seacoasts and their summers in the lakes and deltas of the North.",,"{marsh,water}",2026-06-15 20:15:02.146533,"{16,21,28,32}",encounter,,"[{""region"": ""South Harlindon"", ""probability"": ""Easy""}, {""region"": ""Ardolyalinya"", ""probability"": ""Easy""}, {""region"": ""Minhiriath"", ""probability"": ""Easy""}, {""region"": ""Enedhwaith"", ""probability"": ""Easy""}]"
9477fc2f-324f-4f02-9900-1f1cfca23477,Sauron's Armies,saurons_armies,orcs,all-day,5,"Huge armies of Orcs, Olog-hai (trolls), and Easterling/Haradrim auxiliaries garrisoning the black towers.",,,2026-06-16 22:58:58.653695,{74},encounter,,"[{""region"": ""Mordor"", ""probability"": ""Medium""}]"
c016b81a-0dad-4c6c-87dc-dd489dd87325,Cliff Hornets,cliff_hornets,insects,day,1,"Relatives of the common Mud Dauber Wasp, Cliff Hornets are social insects who build their nest in cracks, crevices, and fissures in the sides of cliffs. Although they will not build nests deep underground, their homes can sometimes be found as much as several hundred feet from a cave entrance if a good nesting site can be found there. These insects are not normally dangerous unless one is an intruder who has blundered into the midst of a nest. Then the outraged Hornets will attack en masse with their sharp, barbless stingers, injecting the victim with a venom that will, at minimum, cause pain and swelling. In addition, many people are allergic to Cliff Hornet venom and may die from its effects. Note: Treat Hornet venom as a first level poison. A normal, nonallergic reaction is -25 to all actions for 1-30 hours. There is a 35% chance (01-35) of allergic reaction, a percentage that may be modified by the victim's Constitution. In the case of an allergic reaction, an incapacitating fever and respiratory distress will afflict the victim for 1-4 days, and five or more stings may cause death in 1 to 10 hours.",,"{mountains,cave}",2026-06-15 16:25:44.988887,"{16,61,70}",encounter,,"[{""region"": ""Eregion"", ""probability"": ""Medium""}, {""region"": ""Minhiriath"", ""probability"": ""Medium""}, {""region"": ""Weather Hills"", ""probability"": ""Medium""}]"
c10a09cc-9896-47ae-bc69-759e871bf6cb,Black Demons,black_demons,demons,all-day,5,"Lesser Maiar allied with Morgoth whose forms and abilities vary infinitely. They can sometimes be persuaded to aid Men or Elves, even in good deeds, but unless the petitioner is carefully protected and binds them with strong constraints little good comes of such bargains; like Balrogs, many partake of natural forces such as fire.",,"{desert,forest,mountains,water,cave}",2026-06-15 16:25:44.988887,{12},encounter,,"[{""region"": ""Harondor"", ""probability"": ""Extremely Hard""}]"
da2be989-38d6-40ef-bd38-1b382996666c,Balrogs,balrogs,demons,all-day,5,"Evil Spirits of Fire (S. ""Demons of Might""), among Morgoth's first allies in the early days of Arda; immortal and singular. The Balrog of Moria (Durin's Bane), perhaps the last of his kind, was roused by deep-delving Dwarves, slew two Dwarf-kings and drove the rest from Moria, and was finally vanquished by Gandalf. Its First Age kin Gothmog and the White Balrog Lungorthin are long gone.",,"{mountains,water,cave}",2026-06-15 16:25:44.988887,{71},encounter,,"[{""region"": ""Moria"", ""probability"": ""Absurd""}]"
f12efd4c-b22b-4ee8-b647-a0df64723463,Sturgeon,sturgeon,water_animals,all-day,0,"The granddaddy of all freshwater fish, the Sturgeon grows up to 18' long in still waters. It has a scaly skin, which is protected by five rows of bony scutes along its sides. Normally very docile, one of these formidable creatures will only attack if its lair is disturbed. Then, it thrashes about angrily, perhaps ramming or upsetting any nearby river craft. Grey and silver, the Sturgeon resides in shallow seas and rivers, feeding on the worms, mollusks, crustaceans, and small fish that live on or near the bottom. They are prized for their meat and their exceedingly tasty eggs.",,{water},2026-06-15 16:25:44.988887,"{11,35,38}",encounter,,"[{""region"": ""Central Anduin"", ""probability"": ""Hard""}, {""region"": ""Nan Anduin"", ""probability"": ""Hard""}, {""region"": ""Lebennin"", ""probability"": ""Hard""}]"
3ebb1f78-5a92-4b93-906f-bf14a89474d2,Barrow Owls,barrow_owls,flying_animals,nocturnal,0,"The Barrow Owl is a small, rare Owl which has taken to living in the open barrows and abandoned gopher tunnels of Eriador (especially in northern Cardolan). Nocturnal and exceedingly specialized, they are virtually blind when confronted with bright light (e.g., in day- or torchlight). This is important, for they startle easily and swarm like Bees when confronted with a potential foe. They carry numerous diseases, including rabies and lycanthresis, to which they are immune. (Normally 2nd-3rd level, the latter disease is a severe psychiatric infliction that affects victims in 110 days and leaves them with the false belief that they are wild animals.)",,{plains},2026-06-15 20:15:02.14116,"{59,61,86}",encounter,,"[{""region"": ""South Downs"", ""probability"": ""Very Hard""}, {""region"": ""Weather Hills"", ""probability"": ""Very Hard""}, {""region"": ""Bree"", ""probability"": ""Very Hard""}]"
0ee34cef-6cd3-4e9b-9ba7-1520a87689ce,Chamber Birds,chamber_birds,flying_animals,day,0,"White, mute, and almost blind, the odd, fungus-eating Chamber Bird is one of the many strange inhabitants of Moria. They seek out the fungus by their remarkable sense of smell (odd indeed for a bird) and note enemies by their inaudibly high cries, in the manner of bats. Their large, gaping beaks have serrated edges and their bluish talons are both sharp and strong. Totally herbivorous (primarily fungivorous), they rarely attack animals unless surprised or starving, though some instinct for meat seems to remain from a predacious ancestor.",,{cave},2026-06-15 20:15:02.142407,{71},encounter,,"[{""region"": ""Moria"", ""probability"": ""Extremely Hard""}]"
597fed89-f1f2-453d-9f90-06181c58d5dd,Green Asps,green_asps,insects,day,1,"The Green Asp is the only venomous serpent indigenous to Calenardhon (Rohan) and the northern White Mountains. It is a sociable creature (for a snake), making its home in as many as fifty of its fellows in empty Rabbit or Ground Squirrel burrows. On sunny days, the Asp community will come out to sun themselves en masse on the slopes near their subterranean home. Green Asps have dull green skin and are usually fat and torpid, with puffy poison glands below their eyes. They are considered unattractive even by those fond of serpents, and a fetid odor reminiscent of rotting strawberries does nothing to relieve this impression. The (5th lvl) bite is rarely fatal, but the area around the wound becomes necrotic, turning awful shades of violet and yellow-green before sloughing off, usually exposing the bone. In some cases (15% chance, modified by Co bonus) the injection may cause the entire limb to turn gangrenous and fall off; otherwise the victim will be incapacitated for 3-6 days with high fever and hallucinations.",,{mountains},2026-06-15 16:25:44.988887,"{1,2,5,6,7,62,63,87}",encounter,,"[{""region"": ""Dor Rhunen"", ""probability"": ""Very Hard""}, {""region"": ""Dorwinion"", ""probability"": ""Absurd""}, {""region"": ""Eothraim"", ""probability"": ""Very Hard""}, {""region"": ""Gramuz"", ""probability"": ""Absurd""}, {""region"": ""Parth Celebrant"", ""probability"": ""Sheer Folly""}, {""region"": ""Rohan"", ""probability"": ""Hard""}, {""region"": ""Wold"", ""probability"": ""Hard""}, {""region"": ""Anorien"", ""probability"": ""Hard""}]"
e11dd6c4-a361-4923-8033-cae26439dffd,Neekerbreekers,neekerbreekers,insects,day,1,"Noisy, cricketlike insects that are found in marshy areas in the northerly regions of Endor (e.g., Arthedain), Neekerbreekers are little more than a major nuisance. Their name is derived from their noisy, incessant night cry. Those experienced with and accustomed to travel in these regions soon learn to tolerate the sound of Neekerbreekers, but travellers carrying dried grains, flour, or waybread are well advised to keep these supplies tightly wrapped in areas where the hideous ""neek-breek, neek-breek!"" can be heard, since Neekerbreekers have been known to infest and devour such food. Neekerbreekers are found in particularly foul swamps. Gigantic relatives of the mosquito, these carnivores prefer solid meat. So, while it does not suck blood, a Neekerbreeker will appropriate small chunks of a man's flesh. Any wound inflicted by a Neekerbreeker has a chance of being infected with Yellow Rheum, a 0 level illness.",,{marsh},2026-06-15 16:25:44.988887,"{48,54,55,56,57,61,73,81}",encounter,,"[{""region"": ""Evendim Hills"", ""probability"": ""Light""}, {""region"": ""Fornost"", ""probability"": ""Extremely Hard""}, {""region"": ""Forochel"", ""probability"": ""Light""}, {""region"": ""Lone-lands"", ""probability"": ""Sheer Folly""}, {""region"": ""Numeriador"", ""probability"": ""Absurd""}, {""region"": ""Rammas Formen"", ""probability"": ""Sheer Folly""}, {""region"": ""Talath Muil"", ""probability"": ""Light""}, {""region"": ""Weather Hills"", ""probability"": ""Sheer Folly""}]"
fc7b9742-fbc4-4e1b-a5be-35cf0a53a58d,Blue Terrapins,blue_terrapins,insects,day,1,"Blue Terrapins (Q. ""Luinikrúmori""; sing. ""Luinikrúmor"") are only found in thickets or very dense, overgrown swamp areas. Their native home is Fangorn Forest. Small, their shells average 18"" across, but they have a 12"" neck. Thus, a Blue Terrapin can strike like a snake, delivering a 2nd level muscle poison (with a Critical Strike) that can paralyze a small mammal (up to 40 lbs). If it bites, it will paralyze the area or limb it penetrates, partially paralyzing one adjacent area. The poison wears off in 3 hours.",,"{marsh,forest}",2026-06-15 16:25:44.988887,{82},encounter,,"[{""region"": ""Fangorn"", ""probability"": ""Medium""}]"
eb66ddd3-e7b9-4c71-8e70-b2b135367b1d,Cliff Buzzards,cliff_buzzards,flying_animals,day,0,"The Cliff Buzzard is a large, black-feathered bird of the mountains. It builds its nest on inaccessible cliffs. Often several pairs will nest in the same area, behavior more typical of the Corvidae (crowlike birds) than of the Raptors (Hawks and so on). Cliff Buzzards exhibit a great deal of intelligence (for birds) and will cooperate in hunting. They will band together to mob some large creature and drive it over a cliff so that they may all feast together on the shattered body. Any wounded creature, no matter what its size, may be subject to the unwanted attentions of the Cliff Buzzards. They are most common on the southern slopes of the White Mountains.",,{mountains},2026-06-15 20:15:02.143277,"{11,13,19,24,35,39,44,45,46,50,66,68,69,76,80}",encounter,,"[{""region"": ""Angmar"", ""probability"": ""Absurd""}, {""region"": ""Central Anduin"", ""probability"": ""Absurd""}, {""region"": ""Central Misty Mountains"", ""probability"": ""Absurd""}, {""region"": ""Coldfells"", ""probability"": ""Sheer Folly""}, {""region"": ""En Udanoriath"", ""probability"": ""Sheer Folly""}, {""region"": ""Ettenmoors"", ""probability"": ""Sheer Folly""}, {""region"": ""Forovirian"", ""probability"": ""Absurd""}, {""region"": ""Iron Hills"", ""probability"": ""Sheer Folly""}, {""region"": ""North Misty Mountains"", ""probability"": ""Absurd""}, {""region"": ""Nurn"", ""probability"": ""Absurd""}, {""region"": ""Rivendell"", ""probability"": ""Sheer Folly""}, {""region"": ""Wilderness of Arnor"", ""probability"": ""Absurd""}, {""region"": ""Lamedon"", ""probability"": ""Medium""}, {""region"": ""Lebennin"", ""probability"": ""Medium""}, {""region"": ""Anfalas"", ""probability"": ""Medium""}]"
5f465085-1130-4763-ac25-16f95107e5d3,Ninfiara Wild Aurochs,ninfiara_wild_aurochs,herbivores,all-day,2,"Great wild oxen of the Ninfiara plains — massive, horned and formidable, untamed forebears of cattle. A charging bull is a peril to any hunter, and even wolves think twice before troubling a herd.",,,2026-06-10 13:23:21.790574,"{17,21}",encounter,,"[{""region"": ""Enedhwaith"", ""probability"": ""Absurd""}, {""region"": ""Rast Vorn"", ""probability"": ""Sheer Folly""}]"
4fde5e29-9bc7-4324-a4bf-615bcdbdc1ba,Orao,orao,flying_animals,day,0,"The Desert Orao is the principal native Eagle of Far Harad. It is quite similar to the Eagles of the North, except that the environment has forced him to play the role of scavenger as well as hunter. These soaring hunters swoop to attack smaller birds or prey on the ground. Unlike the northern birds, the desert Eagle will as readily eat carrion as fresh meat, an adaptation made necessary by the environment. They are aggressive enough to strike travellers along Harad's southern caravan roads. Aside from Men, the Orao are the dominant hunters on the vast plains of southwestern Harad. Their eyries are set in the caverns of the northern Yellow Mountains, and in wind-hollowed caves the highest of the hilly Raj region to the north. In size, they are no match for the Great Eagles, but they are large enough to carry off a shepherd's goat or lamb.",,"{desert,mountains}",2026-06-15 20:15:02.159085,{12},encounter,,"[{""region"": ""Harondor"", ""probability"": ""Hard""}]"
26193900-1221-4e3d-8f7a-3ada3ab17de6,Nethairin,nethairin,insects,day,1,"The Plains Snake (Si. ""Nathair""; pl. ""Nethairin"") is roughly six feet long. It has a thick triangular head and a cream-colored body overlaid with a dark diamond pattern. Hiding in shallow burrows and hunting amidst the tall grass of the steppes or plains, the serpent is a quiet creature that relies on stealth and patience to defeat its foes. Rodents, birds, and small lizards make up its diet. Although ostensibly cunning, the Nathair angers easily and will vigorously defend itself rather than flee, even in a fruitless confrontation. Its venom is rather toxic (level 6); symptoms include swelling, weak pulse, shock, and wide discolorations.",,{plains},2026-06-15 16:25:44.988887,"{1,2,6,8,87}",encounter,,"[{""region"": ""Dor Rhunen"", ""probability"": ""Extremely Hard""}, {""region"": ""Dorwinion"", ""probability"": ""Sheer Folly""}, {""region"": ""Eothraim"", ""probability"": ""Medium""}, {""region"": ""Gramuz"", ""probability"": ""Medium""}, {""region"": ""Dagorlad"", ""probability"": ""Medium""}]"
7cbdc113-2f0e-4d2b-88c2-c10f272abd2c,Nethairin Erdyr,nethairin_erdyr,insects,day,1,"The Nethairin Erdyr (sing. ""Nathair Ardor"") live in burrows beneath rocks or within caverns and favor highland locales or the cool wastelands of the North. While very similar in coloration to the Nathair of the Plains, the Nathair Ardor attains a length of only 2-3 feet. It angers easily and will defend itself viciously. Its poison is similar to that of the common Nathair, however it is weaker (5th lvl) and takes longer (6 vs 2 minutes) to affect the victim.",,"{desert,plains,cave}",2026-06-15 16:25:44.988887,"{45,46,73}",encounter,,"[{""region"": ""Forochel"", ""probability"": ""Medium""}, {""region"": ""Angmar"", ""probability"": ""Medium""}, {""region"": ""Coldfells"", ""probability"": ""Medium""}]"
bdc2a170-feb6-4648-a4e5-8f7793f6b162,Marsh Crocodiles,marsh_crocodiles,reptiles,day,3,"Swift but usually inactive, the Marsh, or ""Fish-eating,"" Crocodiles are common in the wetter, warmer parts of Endor. They are inoffensive when let alone, but can be quite deadly when surprised (or hungry). Black, with green stripes and light blue undersides, they are colorful carnivores. Their diet consists of large mammals and birds who enter or come to the edge of the water. After grabbing its prey in its long, powerful snout, the Marsh Crocodile drowns the victim and then tears the flaccid body apart with twisting bites. It spends its nights in the water and basks on shore during the day, feeding on average once every two days, and swallows rocks for ballast.",,"{marsh,water}",2026-06-15 16:25:44.988887,"{12,38}",encounter,,"[{""region"": ""Harondor"", ""probability"": ""Hard""}, {""region"": ""Nan Anduin"", ""probability"": ""Hard""}]"
efcba268-a561-4ab8-a578-ff88a139833e,Nethraich,nethraich,insects,day,1,"The Nathrach (pl. ""Nethraich"") is an aquatic snake that resides in relatively placid or stagnant pools, marshes, and lakes. Brown bands surround its rust-colored body, which typically measures three to five feet in length. Contrary to popular belief, this serpent does not normally strike in water; most victims are on dry land or a marsh island when they stray into a snake run. These snakes only attack when their ""runs"" are encountered, and then it bites with astounding quickness. A Nathrach's critical strike is accompanied by a muscle poison that causes bleeding, bruises, and swelling (double all these effects on this and subsequent criticals). The venom is not very toxic (level 2) but is designed to stun small rodents. The Arnathrach (pl. ""Ernaithrach""), or Royal Nathrach, is a much larger cousin that inhabits the brackish waters near the coasts.",,"{marsh,water}",2026-06-15 16:25:44.988887,"{2,8,21,38}",encounter,,"[{""region"": ""Gramuz"", ""probability"": ""Extremely Hard""}, {""region"": ""Nan Anduin"", ""probability"": ""Hard""}, {""region"": ""Dagorlad"", ""probability"": ""Hard""}, {""region"": ""Enedhwaith"", ""probability"": ""Hard""}]"
