id,name,slug,type,tier,parent_id,description,url_path,biomes,created_at,region_ids,probability_by_region
d7dd96e9-d666-49c5-a60d-a489a8c58a1f,Beffraen,beffraen,humans,encounter,,"A relatively primitive folk akin to Drúedain, inhabiting the dark woods of the Rast Vorn peninsula; they are secretive, use the treacherous forest and coasts to remain largely outside Dúnadan control and maintain their own customs.[file:31]",,,2026-06-16 22:58:58.653695,"{17,60}","[{""region"": ""Rast Vorn"", ""probability"": ""Medium""}, {""region"": ""Mintyrnath"", ""probability"": ""Medium""}]"
5c42ebd2-c27f-453d-8fe6-a4d03cb6493f,Grass Grouses,grass_grouses,flying_animals,encounter,,"A plump, gallinaceous (chickenlike) bird of the grasslands of Calenardhon (Rohan), the tasty Grass Grouse is the preferred prey of many hunters, be they winged or two- or four-legged. Many a man, Red Fox, or Hawk will pass easier prey by for a crack at a greasy Grass Grouse. Their black-speckled brown plumage provides good camouflage in the tall grasses, so the birds prosper and spread in spite of their inherent appeal to the palate. The male booming mating cry is most reminiscent of a drunk blowing over the neck of a bottle.",,{plains},2026-06-15 16:25:44.988887,"{62,63}","[{""region"": ""Rohan"", ""probability"": ""Light""}, {""region"": ""Wold"", ""probability"": ""Light""}]"
c89386a2-b71f-4243-ab0d-e15d4094c152,Saralainn,saralainn,humans,encounter,1007565e-5a57-46d9-9089-2f94e04a2e01,"Rowdy, semi‑independent clans of Saralainn and the Gwathló mouthlands whose culture blends Dunnish traditions and refugee influences, often providing both raiders and hardy defenders in the south.[file:31]",,,2026-06-16 22:58:58.653695,"{16,60}","[{""region"": ""Minhiriath"", ""probability"": ""Medium""}, {""region"": ""Mintyrnath"", ""probability"": ""Medium""}]"
8c9a346b-5236-4af7-bb9e-14b4c2f51a87,Rohirrim,rohirrim,humans,encounter,06d62e06-9fcb-4dda-93c8-9ca72b211f57,"The Rohirrim (S. ""Masters of Horses"") are the Northmen of Rohan and have a complex ancestry. They settled in Rohan (then Calenardhon) about T.A. 2510 at the request of Cirion, the Steward of Gondor. The grant was a reward for the Northmen's aid in the defeat of the Easterling Balchoth. The Rohirrim call Rohan the Riddermark. Physical Character: Average to stocky and strong. Men average 190 pounds, women 130 pounds. They have considerable amounts of facial hair. Blond, with fair skin and blue eyes. Average endurance, although they can ride as long as their mounts can endure, and as long as they can stay awake. Men average 6'1"", women 5'5"". Lifespan: 60-85 years. +20 bonus to melee Offensive Bonus when fighting from horseback. Herders and horse-masters, they spend much of their year living in various semi-permanent camps set out on a circuit of pastures. They return to their permanent homes for the winter. Some garden or farm. Most Rohirrim are also accomplished hunters and fishermen. The Rohirrim hate the Dunlendings and consider the Woses as lesser beings. They also have an age-old hatred of Orcs, Wargs, Easterlings, and Dragons.",,{mountains},2026-06-15 20:28:26.539932,"{5,14,62,63}","[{""region"": ""Rohan"", ""probability"": ""Medium""}, {""region"": ""Parth Celebrant"", ""probability"": ""Medium""}, {""region"": ""Westmarch"", ""probability"": ""Medium""}, {""region"": ""Wold"", ""probability"": ""Medium""}]"
b95be050-1da4-47ae-b5ea-b2305dd12f4d,Hounds,hounds,carnivores,encounter,,"In Middle-earth the term Hound (Q. Huo, pl. Huron) almost always means the fierce Wolfhound, ranging from the diminutive dogs of Hobbit farmers near the Shire to the great noble beasts the Men of old used to hunt Wargs and the werewolves of Morgoth. Found wherever Men or Hobbits dwell, they sometimes run wild in deserted lands. The most famous was Huan of Valinor, one of the immortal hounds of Orome, who followed Celegorm into exile, aided Luthien and Beren, and both slew and was slain by Carcharoth.",,{mountains},2026-06-15 16:25:44.988887,"{11,57,62,85,86}","[{""region"": ""The Shire"", ""probability"": ""Light""}, {""region"": ""Bree"", ""probability"": ""Light""}, {""region"": ""Rohan"", ""probability"": ""Light""}, {""region"": ""Lebennin"", ""probability"": ""Light""}, {""region"": ""Fornost"", ""probability"": ""Light""}]"
707f6cd9-fdee-4006-96e2-89fcd7b4aa4d,Snow-elves,snow-elves,elves,encounter,,"The Lossidil Snow-elves maintain Helloth, an enchanted ice city on the Landless Land, and patrol the polar wastes and Talath Uichel's far north, guarding Helecthil's radiance and intervening occasionally in mortal affairs.[file:39]",,,2026-06-16 22:58:58.653695,"{67,73}","[{""region"": ""Forochel"", ""probability"": ""Medium""}, {""region"": ""Talath Uichel"", ""probability"": ""Medium""}]"
3ebcfc7a-84a2-40d0-9d85-14eeda750738,Iathrim and Laegrim,iathrim_and_laegrim,elves,encounter,57650ea6-8999-4bf1-acc9-b32b4e23230d,"Sindar (Iathrim) and Green-elves (Laegrim) occupy Harlindon and southern Lindon, many as survivors of drowned Beleriand. Some resist living under Noldorin rule and eventually leave eastward to join Silvan realms, but others remain and shape Lindon's woodland culture and rituals described in the culture and lifestyle sections.[file:99]",,,2026-06-16 22:58:58.653695,"{22,28,30,31,33,49,51,52,53,64,65}","[{""region"": ""Apariach"", ""probability"": ""Medium""}, {""region"": ""Ardquetto"", ""probability"": ""Medium""}, {""region"": ""Vinyalas"", ""probability"": ""Medium""}, {""region"": ""Ascahiriand"", ""probability"": ""Medium""}, {""region"": ""Mänoriand"", ""probability"": ""Medium""}, {""region"": ""Celanoriand"", ""probability"": ""Medium""}, {""region"": ""Sandariand"", ""probability"": ""Medium""}, {""region"": ""Tol Fuin"", ""probability"": ""Medium""}, {""region"": ""Ardolyalinya"", ""probability"": ""Medium""}, {""region"": ""Lairiardhon"", ""probability"": ""Medium""}, {""region"": ""Lildardhon"", ""probability"": ""Medium""}]"
4ddb4f0d-cff8-492d-88ce-8fe319653388,Lindellim,lindellim,elves,encounter,a85ddc65-e8d5-460e-99ea-8b2e6a0f70ec,"Nandor Elves (Lindellim) and Mithrim-related northern Sindar houses contribute additional Elven lineages within Lindon. The appendices detail house histories, territories and military forces, showing how they occupy various parts of Forlindon, Harlindon and Rhûnlindon and how their demographic share grows relative to the Noldor over time.[file:99]",,,2026-06-16 22:58:58.653695,"{22,28,30,31,33,49,51,52,53,64,65}","[{""region"": ""Apariach"", ""probability"": ""Medium""}, {""region"": ""Ardquetto"", ""probability"": ""Medium""}, {""region"": ""Vinyalas"", ""probability"": ""Medium""}, {""region"": ""Ascahiriand"", ""probability"": ""Medium""}, {""region"": ""Mänoriand"", ""probability"": ""Medium""}, {""region"": ""Celanoriand"", ""probability"": ""Medium""}, {""region"": ""Sandariand"", ""probability"": ""Medium""}, {""region"": ""Tol Fuin"", ""probability"": ""Medium""}, {""region"": ""Ardolyalinya"", ""probability"": ""Medium""}, {""region"": ""Lairiardhon"", ""probability"": ""Medium""}, {""region"": ""Lildardhon"", ""probability"": ""Medium""}]"
607a9513-3045-4eb0-8f65-a0a9cb1780a5,Dwarves of the Blue Mountains,dwarves_of_the_blue_mountains,dwarves,group,,"Dwarves inhabit halls and mines on the east side of the Blue Mountains, especially south of the Gulf of Lhûn; Thorin's Halls (Durin's Folk in exile) are located in this Lindon-adjacent zone. The introduction notes that even after all Elves depart in later Ages, Dwarves still dwell in their halls and keep mines in use.[file:99]",,,2026-06-16 22:58:58.653695,"{22,27,28,30,31,33,47,49,51,52,53,64,65}","[{""region"": ""Apariach"", ""probability"": ""Medium""}, {""region"": ""Ardquetto"", ""probability"": ""Medium""}, {""region"": ""Vinyalas"", ""probability"": ""Medium""}, {""region"": ""Ered Luin"", ""probability"": ""Medium""}, {""region"": ""Ascahiriand"", ""probability"": ""Medium""}, {""region"": ""Mänoriand"", ""probability"": ""Medium""}, {""region"": ""Celanoriand"", ""probability"": ""Medium""}, {""region"": ""Sandariand"", ""probability"": ""Medium""}, {""region"": ""Tol Fuin"", ""probability"": ""Medium""}, {""region"": ""Ardolyalinya"", ""probability"": ""Medium""}, {""region"": ""Lairiardhon"", ""probability"": ""Medium""}, {""region"": ""Lildardhon"", ""probability"": ""Medium""}]"
952aa52c-0d33-441f-948e-57860d2a32a5,Goblin King of Gundabad,goblin_king_of_gundabad,orcs,encounter,267142a7-6b80-4b64-ae25-1e9531c778b1,"Title for the tyrannical overlord who rules Mount Gundabad and claims suzerainty over all Orc tribes of the mountains; his court in the spires is rife with intrigue, assassination, and revolt.",,,2026-06-16 22:58:58.653695,{66},"[{""region"": ""Forovirian"", ""probability"": ""Medium""}]"
6495f2bc-bca4-45a0-b299-7dd9a5055526,Priests of Darkness,priests_of_darkness,orcs,encounter,267142a7-6b80-4b64-ae25-1e9531c778b1,"Orcish priests who preserve records of goblin deeds over two Ages and guard secret lore and rituals in hidden chambers, including tales of the coming from Morgoth's realm.",,,2026-06-16 22:58:58.653695,{66},"[{""region"": ""Forovirian"", ""probability"": ""Medium""}]"
32f1100e-4adb-4881-b64e-0211521fab7c,Helechoth,helechoth,humans,encounter,bcf9bf2a-fca1-49d8-b540-a0e0777a047e,"A land-focused Ystvät Talven sub-culture relying heavily on herd management and inland hunting, occupying central Talath Uichel and interacting with both Lossoth and Angmar's frontier forces.[file:39]",,,2026-06-16 22:58:58.653695,{67},"[{""region"": ""Talath Uichel"", ""probability"": ""Medium""}]"
f56448fd-8bf0-4c25-af4a-b0aea9b92337,Umli,umli,dwarves,encounter,,"The Umli live in the Far North of north-central Middle-earth, east of the Lossoth. They are a race of short folk who apparently came from an ancient union of Men and Dwarves. Legends call them Half-dwarves. Physical Character: Strong and compact, with large features and considerable facial hair. Males average 150 pounds; females 135 pounds. Ruddy skin and red hair, with penetrating pale blue eyes. Exceptional endurance in cold climes; average in temperate areas; poor in warm or hot climates. 4-5 feet. Lifespan: 100-200 years. +30 bonus versus cold/ice attacks and a -15 bonus versus heat/fire attacks. Need sleep but three hours a day. In the cold (below 35°) they halve any encumbrance penalties; above 90° they suffer double encumbrance penalties. Hunters, gatherers, and fisherman, they move from site to site depending on the season. Most reside in caves or underground settlements. Many mine, and the Umli are accomplished smiths and artisans.",,"{river,tundra,cave}",2026-06-15 20:28:26.528776,{67},"[{""region"": ""Talath Uichel"", ""probability"": ""Medium""}]"
f9d69ee3-26b3-4fcd-9dee-cf4b8e831e2b,Great Eagles,great_eagles,flying_animals,group,,"The Great Eagles are the most noble of all birds, having been created by the Valar Manwe, Lord of the Air, and Yavanna, Queen of the Earth. Appointed as overseers of all the Kelvar, they have played many glorious roles in the history of Middle-earth. They have rescued numerous champions in their hour of greatest need: both the Noldo Elf Maedhros, imprisoned in Thangorodrim, and Gandalf the Grey, confined at Orthanc by Saruman, owe their salvation to these graceful creatures (they also aided Gandalf after his combat with the Balrog of Moria). Great Eagles are as intelligent as any of the Free Peoples but are not numbered among them, presumably because they lack the power to build things and fashion crafts. These huge birds are not to be trifled with: fierce foes when aroused to anger, with little patience for faint-heartedness in the face of danger. They are stalwart foes of Evil and especially hate any other creature of the air who has allied with the Valar enemies.",,{mountains},2026-06-15 20:15:02.14717,"{3,4,5,9,10,14,25,27,35,36,38,39,45,62,63,66,68,69,72}","[{""region"": ""Central Anduin"", ""probability"": ""Absurd""}, {""region"": ""Central Misty Mountains"", ""probability"": ""Extremely Hard""}, {""region"": ""Dale"", ""probability"": ""Absurd""}, {""region"": ""Druadan Forest"", ""probability"": ""Absurd""}, {""region"": ""Dunland"", ""probability"": ""Absurd""}, {""region"": ""Esgaroth"", ""probability"": ""Absurd""}, {""region"": ""Forovirian"", ""probability"": ""Absurd""}, {""region"": ""Mirkwood Wilds"", ""probability"": ""Absurd""}, {""region"": ""Nan Anduin"", ""probability"": ""Absurd""}, {""region"": ""North Misty Mountains"", ""probability"": ""Extremely Hard""}, {""region"": ""Parth Celebrant"", ""probability"": ""Absurd""}, {""region"": ""Rohan"", ""probability"": ""Absurd""}, {""region"": ""Ronen-in-Anduin"", ""probability"": ""Absurd""}, {""region"": ""Westmarch"", ""probability"": ""Absurd""}, {""region"": ""Wold"", ""probability"": ""Absurd""}, {""region"": ""Woodland Realm"", ""probability"": ""Absurd""}, {""region"": ""Ered Luin"", ""probability"": ""Extremely Hard""}, {""region"": ""Wilderness of Arnor"", ""probability"": ""Medium""}, {""region"": ""Coldfells"", ""probability"": ""Medium""}]"
aa6753b4-ba46-47b2-88cc-3e0d23036707,Noldor,noldor,elves,group,,"The Noldor are often called ""High Elves"" or ""Deep Elves"", ostensibly because they are considered to be the most noble of the Quendi in Middle-earth. In reality, they are so named because they are the only Elves living in Endor who have ever resided in the Blessed Realm of Aman across the sea. This exalted status is accentuated by their close ties with the Valar, a relationship which accounts for their unique cultural and linguistic roots. Other names for the Noldor include Deep-elves, Golodhrim or Gelydh (Sindarin labels), and Nómin (Edain label). Physical Character: Of all the Elves, the Noldor are the strongest and sturdiest of build, although they are still slimmer than Men. Most are dark haired and have greyish eyes which betray a proud looking manner. Descendants of the Fingolfin and Finarfin are often fair haired and blue eyed, for their blood contains Vanyar influences. They do not carry great burdens, but they are capable of traveling 16-20 hours a day. The Noldor do not sleep; instead they rest in a trance for 1-3 hours a day. Males average 6'7"", females 6'3"". Immortal and will only die due to violence or if they weary of life and lose the will to live. Cannot become sick or scarred and are virtually immune to disease. +20 bonus versus cold attacks. Unparalleled at understanding and working with crafts. +20 for Item Use rolls.",,"{river,tundra}",2026-06-15 20:28:26.530672,"{22,28,30,31,33,49,51,52,53,64,65,70}","[{""region"": ""Apariach"", ""probability"": ""Medium""}, {""region"": ""Ardquetto"", ""probability"": ""Medium""}, {""region"": ""Vinyalas"", ""probability"": ""Medium""}, {""region"": ""Eregion"", ""probability"": ""Medium""}, {""region"": ""Ascahiriand"", ""probability"": ""Medium""}, {""region"": ""Mänoriand"", ""probability"": ""Medium""}, {""region"": ""Celanoriand"", ""probability"": ""Medium""}, {""region"": ""Sandariand"", ""probability"": ""Medium""}, {""region"": ""Tol Fuin"", ""probability"": ""Medium""}, {""region"": ""Ardolyalinya"", ""probability"": ""Medium""}, {""region"": ""Lairiardhon"", ""probability"": ""Medium""}, {""region"": ""Lildardhon"", ""probability"": ""Medium""}]"
41589eb0-7981-4841-9648-a1aef5f9d2bc,Dwarves of Khazad-dum,dwarves_of_khazad-dum,dwarves,encounter,f637cca6-c509-44bd-80bf-68313c65696f,"Durin's Folk in their ancestral seat of Khazad-dum (Moria); allied Dwarves who trade extensively with the Noldor of Eregion, exchanging ores and craft for Elven goods and knowledge, a friendship driven by shared interest in craft and learning.",,,2026-06-16 22:58:58.653695,{70},"[{""region"": ""Eregion"", ""probability"": ""Medium""}]"
5b54084b-a9b2-4ccf-b2cd-bc630ab41500,Celebrimbor,celebrimbor,elves,encounter,aa6753b4-ba46-47b2-88cc-3e0d23036707,"Master Smith, founder of the Gwaith-i-Mírdain and de facto leader of the craft community; arguably the second-greatest Elven smith after Fëanor, and the maker of the Three Rings.",,,2026-06-16 22:58:58.653695,{70},"[{""region"": ""Eregion"", ""probability"": ""Medium""}]"
fcdd4c2a-4a10-408b-8a33-6fb81c70f563,Orcs of Khazad-dum,orcs_of_khazad-dum,orcs,encounter,267142a7-6b80-4b64-ae25-1e9531c778b1,Sauron's servants who plunder the ancient dwarven vaults.,,,2026-06-16 22:58:58.653695,"{8,71}","[{""region"": ""Dagorlad"", ""probability"": ""Medium""}, {""region"": ""Moria"", ""probability"": ""Medium""}]"
6ab39e95-0bd0-4820-8ccd-ac376357a8aa,Daen Iontis,daen_iontis,humans,encounter,1007565e-5a57-46d9-9089-2f94e04a2e01,"Militant Dunnish faction exemplified by clan Arailt and their allies, bitterly hating Dúnedain, closely linked to the Temple of Justice, and pushing for war and a harsh, sacrificial religion that twists old Daen beliefs.[file:32]",,,2026-06-16 22:58:58.653695,"{21,72}","[{""region"": ""Dunland"", ""probability"": ""Medium""}, {""region"": ""Enedhwaith"", ""probability"": ""Medium""}]"
1f8f956e-c5c1-4bda-abb1-140705ba39ce,Vault Shrikes,vault_shrikes,flying_animals,encounter,,"The Vault Shrike is a tiny, bright red Bat with a long nose and tongue with which it pokes into holes and crevices for insects to eat. It also secretes from its tongue a highly toxic nerve poison that enables it to deal with larger prey. These Vault Shrikes paralyze or kill by means of the poison. It then rips its victims to shreds with its tiny sharp teeth. The Vault Shrike diet is further enhanced by its ability to catch small frogs in an ironically froglike manner: by snatching them in midleap with that long tongue. Vault Shrikes get their name from their unnerving, shrieking cry. They are only found in Moria and the caverns of the Misty Mountains.",,"{mountains,cave}",2026-06-15 16:25:44.988887,"{39,68,71}","[{""region"": ""Moria"", ""probability"": ""Very Hard""}, {""region"": ""Central Misty Mountains"", ""probability"": ""Very Hard""}, {""region"": ""North Misty Mountains"", ""probability"": ""Very Hard""}]"
2f60828e-88fc-4e12-98df-27d6e74ce5af,Merënyetsënyt,mernyetsnyt,humans,encounter,bcf9bf2a-fca1-49d8-b540-a0e0777a047e,"Ystvät Talven who dwell on moving icebergs and along the Bay of Forochel's shores, hunting whales, seals and walruses; they are stocky, short, fair-haired and remarkably resistant to cold and immersion, but suffer high mortality from the hazards of the sea.[file:39]",,,2026-06-16 22:58:58.653695,{73},"[{""region"": ""Forochel"", ""probability"": ""Medium""}]"
121d27ca-c324-4051-afa6-32d488c8f4ae,Noldorin mystics,noldorin_mystics,elves,encounter,aa6753b4-ba46-47b2-88cc-3e0d23036707,"An obscure order of Noldorin mystics maintains Evermist, a hidden valley on the Cape of Forochel that serves as a haven for the Free Peoples and base for resistance to the Witch-king of Angmar.[file:39]",,,2026-06-16 22:58:58.653695,{73},"[{""region"": ""Forochel"", ""probability"": ""Medium""}]"
401450db-8a05-4c49-a841-088ec3b6c5a5,Olog-hai,olog-hai,trolls,encounter,,"The Olog-hai have been bred by Sauron from lesser Troll stock, and have until late been a rare breed. Cunning and organized - yet as big and strong as their lesser brethren - the Olog-hai are superb Warriors. They know no fear, and thirst for blood and victory. Olog-hai are also called Black Trolls, for they have black scaly hides and black blood. Most carry blank shields and war hammers, although they are adept at using almost any weapon. They differ from older Troll varieties in other ways as well: (1) they ignore bleeding or stun results when given a critical strike from a normal weapon, since they are more resistant to unenchanted weapons; (2) they can operate freely in daylight; (3) they are relatively quick; and (4) they are capable of using normal language properly, and speak Black Speech (Rank 5) and Westron (Rank 3).",,{mountains},2026-06-15 20:28:26.545824,,
17016909-f35e-425e-a6b5-354d95b0d1ae,Half-trolls,half-trolls,trolls,encounter,,"Half-trolls are the product of a union of Olog-hai and Variag Men. For this reason, they are sometimes confused with Black Trolls, but they are smaller and quicker and vaguely resemble Men. Their 7' height, jet-black skin, long sharp red tongues, and glowing red eyes should also serve notice of their uniqueness. Half-trolls differ from Olog-hai in other ways: (1) they wear crude black clothing and considerable amounts of armor; (2) they are kept away from other Trolls; (3) they are as intelligent as Men; and (4) they are more agile. Given their increased minds, they get two background points.",,"{mountains,tundra}",2026-06-15 20:28:26.546111,,
f88be998-fd2d-4737-bc83-3356ed5e3447,Half-elves,half-elves,elves,group,,"Half-elves are a rare breed, the offspring of Men and Elves. While the Dúnedain, Corsairs, and Black Númenoreans have Elvish (and even Maia) blood, their connection to Elves lies in the remote past and they are not called Half-elves. True Half-elves have one Elven parent and one Mannish parent. Upon reaching adulthood, a Half-elf must decide whether to live as a mortal Man or an immortal Elf. Elrond of Rivendell chose the latter course, while his brother Elros - first King of Númenor - opted for mortality. Physical Character: Strong and slender, thinner than Men but stouter than Elves. They have thin, angular features. Males average 200 pounds, females 140 pounds. Fair, generally with brown or black hair and grey eyes. Considerable endurance. Half-elves need but 4 hours rest a day: sleep for mortals or meditation for the immortals. Males average 6'3"", females 5'11"". Mortal Half-elves live 250-500 years. Virtually immune to disease and natural illness. +5 bonus against cold attacks. Can see extremely well in the dark. Under moonlight or starlight they can see perfectly for 500'.",,"{river,tundra}",2026-06-15 20:28:26.529816,,
3185fd77-6d4e-4580-9ddf-0a55a357e3fa,Echo Hawks,echo_hawks,flying_animals,encounter,,"The Echo Hawk is a large subterranean bird and a menace that few would expect to meet underground in a cave. It is a raptor that has totally adapted to life in a lightless environment, utilizing both infravision and echo-location for its hunting. The echo Hawk nostrils are unusually large, giving it a keenness of scent quite rare in a bird. Its beak and talons are large, hard, and sharp, so much so that the Echo Hawk can pierce through most types of armor. As is usual with the raptors, the female Hawk is larger than the male. Otherwise the sexes are similar, with dull white feathers, colorless skin, and beaks and talons like translucent horn.",,{cave},2026-06-15 16:25:44.988887,"{39,68,71}","[{""region"": ""Central Misty Mountains"", ""probability"": ""Very Hard""}, {""region"": ""North Misty Mountains"", ""probability"": ""Very Hard""}, {""region"": ""Moria"", ""probability"": ""Very Hard""}]"
33f0f6c5-37e2-4b3e-a791-116acba19536,Flying Foxes,flying_foxes,flying_animals,encounter,,"A variety of large bat, the Flying Fox makes its home amid brambles or in the tops of dense, partially-submerged trees of the coastal wetlands. They are most common in the marshes and scrublands of the East, although a few smaller varieties make their homes in Rhun and one group lives in southern Eriador. Unlike most bats, the Flying Fox thrives in daylight, having good eyesight and a refined sense of smell. Using its long snout, it hunts rodents in the scrub and bites wild berries which might elude its more flatfaced cousins. The Flying Fox is considered synonymous with evil magic in many areas of eastern Middle-earth.",,"{marsh,mountains}",2026-06-15 16:25:44.988887,"{2,6,21,87}","[{""region"": ""Dor Rhunen"", ""probability"": ""Medium""}, {""region"": ""Dorwinion"", ""probability"": ""Medium""}, {""region"": ""Gramuz"", ""probability"": ""Medium""}, {""region"": ""Enedhwaith"", ""probability"": ""Medium""}]"
606782e6-e26f-4a19-97cf-def67ba76fdb,Great Falcons Of Mirkwood,great_falcons_of_mirkwood,flying_animals,encounter,,"Rarely seen despite their huge size, Great Falcons reside in the remoter and higher reaches of the Forest of Mirkwood (actually most reside in the Emyn-nu-Fuin, the ""Mountains of Mirkwood""). They are almost untameable, probably due to the difficulty of hooding and confining such a huge bird, even as an eyas (fledgling). Great Falcons are surprisingly maneuverable for such large birds, as is necessary for any winged beast that would live in the dense forest. Their light build makes them unable to carry more than around 70 lbs, so they make poor mounts.",,"{forest,mountains}",2026-06-15 16:25:44.988887,"{3,4,83}","[{""region"": ""Woodland Realm"", ""probability"": ""Sheer Folly""}, {""region"": ""Mirkwood Wilds"", ""probability"": ""Sheer Folly""}, {""region"": ""Dor Guldur"", ""probability"": ""Sheer Folly""}]"
b4c50a02-ea2c-4e57-8a28-23d45092d528,Red Eagles,red_eagles,flying_animals,encounter,,"The Red Eagle dominates the skies of the East. Smaller relatives of the Great Eagles, who are rare in eastern Endor, these magnificent predators are relatively numerous and pose a threat to travellers in the Red Mountains and Mountains of the Wind. Fortunately, though, they usually prefer to hunt goats, sheep, or wild horses. Red Eagles are known for the deep red hue that accents the tips of their gold-colored plumage. They have scarlet beaks.",,{mountains},2026-06-15 16:25:44.988887,"{6,87}","[{""region"": ""Dor Rhunen"", ""probability"": ""Very Hard""}, {""region"": ""Dorwinion"", ""probability"": ""Very Hard""}]"
